description,url
chaotic neutral alignment kinda care kinda amp funny quote classic shirt,https://www.redbubble.com/i/t-shirt/Chaotic-Neutral-Alignment-Kinda-Care-Kinda-Donandamp-39-t-Funny-Quotes-by-pixeptional/30683492.IJ6L0
kyo juro fire classic shirt,https://www.redbubble.com/i/t-shirt/Kyo-juro-Fire-by-ChrisDalida/82652437.QUQES
coffee pullover sweatshirt,https://www.redbubble.com/i/sweatshirt/The-Coffee-by-deniart/44083178.LEP2X
wolf essential shirt,https://www.redbubble.com/i/t-shirt/Wolf-by-jimiyo/9953396.G22WK
frankly dear give damn classic shirt,https://www.redbubble.com/i/t-shirt/Frankly-my-dear-I-don-t-give-a-damn-by-KsuAnn/25812645.IJ6L0
alien abduction club classic shirt,https://www.redbubble.com/i/t-shirt/Alien-Abduction-Club-by-stevenrhodes/40320017.7KE4Y
dollop shirt essential shirt,https://www.redbubble.com/i/t-shirt/The-Dollop-2014-T-Shirt-by-MrFoz/16026015.G22WK
ghost stringbean v classic shirt,https://www.redbubble.com/i/t-shirt/Ghost-and-Stringbean-V1-by-TOHFZ-Elements/144730894.22W0K
margarita time classic shirt,https://www.redbubble.com/i/t-shirt/Margarita-Time-by-andibird/52475097.WFLAH
plant lover polyhedral dice tabletop rpg pullover hoodie,https://www.redbubble.com/i/hoodie/Plant-Lovers-Polyhedral-D20-Dice-Tabletop-RPG-by-pixeptional/32185672.YFBT8
visit raccoon city essential shirt,https://www.redbubble.com/i/t-shirt/Visit-Raccoon-City-by-rustenico/36944495.FB110
lord ding classic shirt,https://www.redbubble.com/i/t-shirt/Lord-of-the-Dings-by-atartist/5198726.IJ6L0
time pullover hoodie,https://www.redbubble.com/i/hoodie/TIME-by-Dandeelion/34194403.YFBT8
formula racing car classic shirt,https://www.redbubble.com/i/t-shirt/Formula-Racing-Cars-2023-by-marieltoigo/94934328.IJ6L0
tomorrow another day classic shirt,https://www.redbubble.com/i/t-shirt/After-All-Tomorrow-is-Another-Day-by-KsuAnn/25812514.IJ6L0
digital tree essential shirt,https://www.redbubble.com/i/t-shirt/Digital-Tree-by-Tigr/22601804.FB110
abstract godfather pullover sweatshirt,https://www.redbubble.com/i/sweatshirt/Abstract-of-Godfather-by-NoraMohammed/44049365.LEP2X
nice thing classic shirt,https://www.redbubble.com/i/t-shirt/This-is-Why-We-Can-t-Have-Nice-Things-by-obinsun/21875858.IJ6L0
save clock tower lightweight sweatshirt,https://www.redbubble.com/i/sweatshirt/Save-The-Clock-Tower-by-DeepFriedArt/22058284.0LCRC
space heartbeat lightweight hoodie,https://www.redbubble.com/i/hoodie/Space-Heartbeat-by-carbine/28995330.O6XP1
think therefore possum classic shirt,https://www.redbubble.com/i/t-shirt/I-do-not-think-therefore-i-do-not-am-possum-by-BattleGoat/114300605.IJ6L0
psychedelic hippy retro peace art classic shirt,https://www.redbubble.com/i/t-shirt/Psychedelic-Hippy-Retro-Peace-Art-by-Alondra/22474765.VL7OD
skateboarding frog classic shirt,https://www.redbubble.com/i/t-shirt/Skateboarding-Frog-by-SaradaBoru/24705507.QUQES
blue sun logo firefly essential shirt,https://www.redbubble.com/i/t-shirt/Blue-Sun-Logo-Firefly-by-RennHarper/11547543.UHLBD
sr classic shirt,https://www.redbubble.com/i/t-shirt/SR388-by-tchuk/11328416.9V5H1
season rome essential shirt,https://www.redbubble.com/i/t-shirt/Seasons-of-Rome-by-OSPYouTube/39843006.NL9AC
old school japanese panther classic shirt,https://www.redbubble.com/i/t-shirt/Old-School-Japanese-Panther-by-MorettiOni97/145732657.240QL
majin buu v patrick funny motivational gym essential shirt,https://www.redbubble.com/i/t-shirt/Majin-Buu-vs-Patrick-Funny-Motivational-Gym-by-gohanflex/65647445.M4A2N
time alive lightweight hoodie,https://www.redbubble.com/i/hoodie/What-A-Time-To-Be-Alive-by-DinoMike/36490886.O6XP1
morning suck classic shirt,https://www.redbubble.com/i/t-shirt/Mornings-Suck-by-DinoMike/20514556.XNZKR
time illusion tank top,https://www.redbubble.com/i/tank-top/TIME-IS-AN-ILLUSION-by-ManaFromHeaven/20192138.B4HC7
mod flower retro color charcoal classic shirt,https://www.redbubble.com/i/t-shirt/Mod-Flowers-in-Retro-Colors-on-Charcoal-by-daisy-beatrice/38931927.S7RYU
sloth hiking team get get funny vintage pullover hoodie,https://www.redbubble.com/i/hoodie/Sloth-Hiking-Team-We-will-get-there-when-we-get-there-Funny-Vintage-by-alenaz/37590361.YFBT8
black mesa research facility classic shirt,https://www.redbubble.com/i/t-shirt/Black-Mesa-Research-Facility-by-LightningDes/41859382.IJ6L0
big lebowski opinion man essential shirt,https://www.redbubble.com/i/t-shirt/The-Big-Lebowski-Just-Your-Opinion-Man-by-deanfredrex/20392752.DBIAX
ron hope swanson classic shirt,https://www.redbubble.com/i/t-shirt/Ron-hope-swanson-by-kurticide/15480395.S7RYU
banksy letting love go balloon girl essential shirt,https://www.redbubble.com/i/t-shirt/Banksy-Letting-Love-Go-Balloon-Girl-by-ThatMerchStore/32304726.NL9AC
mo eisley trading co classic shirt,https://www.redbubble.com/i/t-shirt/Mos-Eisley-Trading-Co-by-Purakushi/28888573.22W0K
band vintage retro concert essential shirt,https://www.redbubble.com/i/t-shirt/The-Band-Vintage-Retro-Concert-by-threeampersands/37500953.CW2C9
star trek deep space nine space station logo classic shirt,https://www.redbubble.com/i/t-shirt/Star-Trek-Deep-Space-Nine-Space-Station-Logo-by-FifthSun/40822641.IJ6L0
eat rich doner ner kebab karl marx socialist hasan piker classic shirt,https://www.redbubble.com/i/t-shirt/Eat-The-Rich-Doner-D%C3%B6ner-Kebab-Karl-Marx-Socialist-Hasan-Piker-by-hypewearco/91058739.WFLAH
stay curious amoeba sister classic shirt,https://www.redbubble.com/i/t-shirt/Stay-Curious-with-the-Amoeba-Sisters-by-amoebasisters/27761952.IJ6L0
dune atreides pullover hoodie,https://www.redbubble.com/i/hoodie/Dune-ATREIDES-by-7115/90262449.YFBT8
dune atreides pullover hoodie,https://www.redbubble.com/i/hoodie/Dune-ATREIDES-by-7115/90262449.YFBT8
twice nebula classic shirt,https://www.redbubble.com/i/t-shirt/Twice-Nebula-by-ClaireCrisci/26908024.IJ6L0
library kitten war classic shirt,https://www.redbubble.com/i/t-shirt/Library-Kitten-Wars-by-TaylorRoss1/60451080.IJ6L0
pocket mage essential shirt,https://www.redbubble.com/i/t-shirt/Pocket-mage-by-metrokard/10762984.88ZX2
nerd fun classic shirt,https://www.redbubble.com/i/t-shirt/Nerds-have-more-fun-by-Meowkittykat/4997574.WFLAH
two half men pavlov dog classic shirt,https://www.redbubble.com/i/t-shirt/Two-and-a-Half-Men-Pavlov-s-Dogs-by-IncognitoMode/33090619.WFLAH
death metal funny unicorn rainbow mosh parody design essential shirt,https://www.redbubble.com/i/t-shirt/DEATH-METAL-Funny-Unicorn-Rainbow-Mosh-Parody-Design-by-badbugs/14919030.FB110
garden shrooms classic shirt,https://www.redbubble.com/i/t-shirt/Garden-of-Shrooms-2020-by-DanJohnDesign/27684969.WFLAH
butch essential shirt,https://www.redbubble.com/i/t-shirt/Butch-by-BendeBear/17908382.NL9AC
black great ramen dragon kanagawa essential shirt,https://www.redbubble.com/i/t-shirt/Black-Great-Ramen-Dragon-off-Kanagawa-by-ilustrata/94051231.FB110
bada bing essential shirt,https://www.redbubble.com/i/t-shirt/Bada-Bing-by-Aguvagu/10426168.FB110
era colorful version classic shirt,https://www.redbubble.com/i/t-shirt/ALL-ERAS-Colorful-version-by-marianaavilal/144993365.WFLAH
dance pink death classic shirt,https://www.redbubble.com/i/t-shirt/Dance-With-Pink-Death-by-TheWhiteBear/54309037.WFLAH
capsule akira neo tokyo classic shirt,https://www.redbubble.com/i/t-shirt/The-Capsules-Akira-Neo-Tokyo-2019-by-sachpica/49633554.WFLAH
stake high essential shirt,https://www.redbubble.com/i/t-shirt/Stakes-is-high-by-thehiphopshop/33000082.FB110
attempted murder essential shirt,https://www.redbubble.com/i/t-shirt/Attempted-Murder-by-jezkemp/9111328.NL9AC
chloe price black red raven life strange storm classic shirt,https://www.redbubble.com/i/t-shirt/Chloe-Price-Black-Red-Raven-Life-Is-Strange-Before-The-Storm-by-Miryinthesky/27933515.WFLAH
element hip hop essential shirt,https://www.redbubble.com/i/t-shirt/4-Elements-of-Hip-Hop-by-trev4000/14207240.FB110
dog day classic shirt,https://www.redbubble.com/i/t-shirt/Dog-days-by-SaryandSaff/15463209.WFLAH
beast active shirt,https://www.redbubble.com/i/t-shirt/I-m-a-Beast-by-Akolytus/40643656.UGYPM
funny pew pew madafakas cat classic shirt,https://www.redbubble.com/i/t-shirt/Funny-Pew-Pew-Madafakas-Cat-by-monsterclub/53384404.WFLAH
wormhole x treme essential shirt,https://www.redbubble.com/i/t-shirt/Wormhole-X-treme-by-McPod/16921483.UIIS2
tiger classic shirt,https://www.redbubble.com/i/t-shirt/Tiger-by-Dragon84/8481030.2EZFS
f desantis censored gay pride flag white classic shirt,https://www.redbubble.com/i/t-shirt/F-DeSantis-Censored-with-a-Gay-Pride-Flag-white-by-Thelittlelord/106179750.IJ6L0
glow stick party classic shirt,https://www.redbubble.com/i/t-shirt/The-Glow-Stick-Party-by-Veata/22645334.IJ6L0
definitely mimic tabletop rpg gaming essential shirt,https://www.redbubble.com/i/t-shirt/Definitely-Not-A-Mimic-Tabletop-RPG-Gaming-by-pixeptional/32999177.9CILC
star lord alien shirt essential shirt,https://www.redbubble.com/i/t-shirt/Star-Lord-s-Alien-Shirt-by-Chairboy/24216428.M4A2N
princess icon classic shirt,https://www.redbubble.com/i/t-shirt/Princess-Icon-Y-by-haz5077/141713227.XNZKR
vintage retro stripe graphic shirt,https://www.redbubble.com/i/t-shirt/70s-Vintage-Retro-Stripes-by-ind3finite/78621432.1YYVU
transparent magnus archive logo season classic shirt,https://www.redbubble.com/i/t-shirt/Transparent-The-Magnus-Archives-Logo-Season-5-by-RustyQuill/52631197.IJ6L0
pale blue dot carl sagan original design classic shirt,https://www.redbubble.com/i/t-shirt/Pale-Blue-Dot-Carl-Sagan-Original-Design-by-catofnimes/20821528.IJ6L0
mandala bee essential shirt,https://www.redbubble.com/i/t-shirt/Mandala-Bees-by-Theysaurus/21152044.FB110
biceratops bisexual triceratops classic shirt,https://www.redbubble.com/i/t-shirt/Biceratops-Bisexual-Triceratops-by-jezkemp/20445174.240QL
sunnydale high school class essential shirt,https://www.redbubble.com/i/t-shirt/Sunnydale-High-School-Class-of-99-by-huckblade/31924715.6N0CH
alpha male classic shirt,https://www.redbubble.com/i/t-shirt/Alpha-Male-by-bresquilla/139103870.WFLAH
pool shark ahhh time relax classic shirt,https://www.redbubble.com/i/t-shirt/Pool-Shark-Ahhh-Time-to-Relax-by-HabbyArt/48703746.240QL
smyrna skull classic shirt,https://www.redbubble.com/i/t-shirt/Smyrna-Skull-by-aligulec/20101957.IJ6L0
feel classic shirt,https://www.redbubble.com/i/t-shirt/Feels-by-exceedingdeath/51792456.WFLAH
gay pride spartan helm classic shirt,https://www.redbubble.com/i/t-shirt/Gay-Pride-Spartan-Helm-by-ScapegoatPrints/32245308.IJ6L0
peaceful landscape classic shirt,https://www.redbubble.com/i/t-shirt/Peaceful-Landscape-by-againstbound/11302084.QUQES
mystery maniac essential shirt,https://www.redbubble.com/i/t-shirt/MYSTERY-MANIACS-by-MINION-FACTORY/30607888.FB110
science study classic shirt,https://www.redbubble.com/i/t-shirt/Science-Studies-by-robyriker/29048631.S7RYU
bloody beast classic shirt,https://www.redbubble.com/i/t-shirt/Bloody-Beast-by-findtees/41577841.IJ6L0
stray logo essential shirt,https://www.redbubble.com/i/t-shirt/Stray-Logo-by-BrotherOfPerl/50181303.FB110
star trek deep space nine quark bar distressed logo classic shirt,https://www.redbubble.com/i/t-shirt/Star-Trek-Deep-Space-Nine-Quark-s-Bar-Distressed-Logo-by-FifthSun/40823211.IJ6L0
supermom super mom mother day classic shirt,https://www.redbubble.com/i/t-shirt/Supermom-Super-Mom-Mother-s-day-by-shoppingMousta/47595046.IJ6L0
spinal tap nigel green skeleton graphic shirt,https://www.redbubble.com/i/t-shirt/Spinal-Tap-Nigel-s-Green-Skeleton-by-Pop-Pop-P-Pow/103169269.1YYVU
shirt clothing essential shirt,https://www.redbubble.com/i/t-shirt/Shirt-Just-Some-Clothing-by-designeclipse/32177401.FB110
princess bride visit cliff insanity classic shirt,https://www.redbubble.com/i/t-shirt/Princess-Bride-Visit-the-Cliffs-of-Insanity-by-IfDesignGroup/82571968.IJ6L0
opossum tattoo live fast eat trash scream as classic shirt,https://www.redbubble.com/i/t-shirt/Opossum-tattoo-Live-fast-eat-trash-scream-at-own-ass-by-evilkidart/34499903.IJ6L0
woof grrr sniff lick essential shirt,https://www.redbubble.com/i/t-shirt/Woof-grrr-sniff-and-lick-by-lazarusheart/29468257.FB110
life aquatic jaguar shark essential shirt,https://www.redbubble.com/i/t-shirt/The-Life-Aquatic-Jaguar-Shark-by-KodiSershon/10548311.UIIS2
death grip money store album cover censored essential shirt,https://www.redbubble.com/i/t-shirt/death-grips-the-money-store-album-cover-censored-by-CleverJane/40899681.FB110
platonic solid cosmic alignment classic shirt,https://www.redbubble.com/i/t-shirt/PLATONIC-SOLIDS-COSMIC-ALIGNMENT-by-RAFAROMAN/24182615.IJ6L0
goblincore frog mushroom snail moth insect vintage biology nature lover science biology natural history classic shirt,https://www.redbubble.com/i/t-shirt/Goblincore-Frog-Mushroom-Snail-Moth-Insect-Vintage-Biology-Nature-Lover-Science-Biology-Natural-History-by-MinistryOfFrogs/84497284.9V5H1
north wilkesboro speedway classic shirt,https://www.redbubble.com/i/t-shirt/North-Wilkesboro-Speedway-1947-by-AstroZombie6669/123430066.0S66D
wolf witch l version blaidd ranni elden classic shirt,https://www.redbubble.com/i/t-shirt/Wolf-and-The-WItch-L-Version-Blaidd-and-Ranni-Elden-by-vertei/122627668.WFLAH
mazdaspeed essential shirt,https://www.redbubble.com/i/t-shirt/Mazdaspeed-by-melvtec/28956210.FB110
dungeon cat essential shirt,https://www.redbubble.com/i/t-shirt/Dungeons-and-Cats-by-Domiichan/29159960.UIIS2
beware smiling dungeon master classic shirt,https://www.redbubble.com/i/t-shirt/Beware-of-the-Smiling-Dungeon-Master-by-optimisteve/25974058.WFLAH
swallow sun zipped hoodie,https://www.redbubble.com/i/hoodie/Swallow-The-Sun-by-thepapercrane/25878739.AJ57R
vintage rocinante classic shirt,https://www.redbubble.com/i/t-shirt/Vintage-Rocinante-by-kg07/69975307.IJ6L0
stranger thing group shot bike ride upside silhouette classic shirt,https://www.redbubble.com/i/t-shirt/Stranger-Things-Group-Shot-Bike-Ride-Upside-Down-Silhouette-by-FifthSun/125353851.IJ6L0
flower heart spring tobe fonseca classic shirt,https://www.redbubble.com/i/t-shirt/Flower-Heart-Spring-by-Tobe-Fonseca-by-tobiasfonseca/24956670.IJ6L0
nerv logo neon genesis evangelion essential shirt,https://www.redbubble.com/i/t-shirt/Nerv-Logo-Neon-Genesis-Evangelion-by-imposibear/23071042.FB110
mothman funny essential shirt,https://www.redbubble.com/i/t-shirt/The-Mothman-Funny-by-Mahmoud55/87691776.FB110
forbidden planet poster classic shirt,https://www.redbubble.com/i/t-shirt/Forbidden-Planet-Poster-by-UnconArt/29139103.IJ6L0
paintroid essential shirt,https://www.redbubble.com/i/t-shirt/Paintroid-by-tchuk/21169718.GDEN5
piece cthulhu tank top,https://www.redbubble.com/i/tank-top/Pieces-of-Cthulhu-by-FlowerRain/27271823.B4HC7
ski hoth active shirt,https://www.redbubble.com/i/t-shirt/Ski-Hoth-by-floresarts/20443348.UGYPM
morning ritual classic shirt,https://www.redbubble.com/i/t-shirt/The-Morning-Ritual-by-stevenrhodes/67675080.S7RYU
man love fearless classic shirt,https://www.redbubble.com/i/t-shirt/man-I-love-fearless-by-alanxshby/77705111.WFLAH
delorean classic shirt,https://www.redbubble.com/i/t-shirt/Delorean-by-florentbodart/27590711.WFLAH
red dragon single solitary peak fan art lightweight sweatshirt,https://www.redbubble.com/i/sweatshirt/Red-Dragon-Above-A-Single-Solitary-Peak-Fan-Art-by-boberttrelfa/24008413.NUC7A
lean machine classic shirt,https://www.redbubble.com/i/t-shirt/Lean-Machine-by-RichSkipworth/17337022.WFLAH
summer cat classic shirt,https://www.redbubble.com/i/t-shirt/Summer-Cat-by-clingcling/15155774.WFLAH
flower film midsommar logo essential shirt,https://www.redbubble.com/i/t-shirt/A24-Flower-films-Midsommar-Logo-by-Samsar/76525953.NL9AC
cockatiel bicycle classic shirt,https://www.redbubble.com/i/t-shirt/Cockatiel-on-a-Bicycle-by-SophieCorrigan/31767512.WFLAH
science like magic real essential shirt,https://www.redbubble.com/i/t-shirt/SCIENCE-It-s-Like-Magic-But-Real-by-RedYolk/28615036.NL9AC
moon song pullover hoodie,https://www.redbubble.com/i/hoodie/Moon-Song-by-expo/34718651.YFBT8
bean dumpster fire classic shirt,https://www.redbubble.com/i/t-shirt/Beans-Dumpster-Fire-by-Catwithhardhat/103625293.7KE4Y
bloodborne caryll rune essential shirt,https://www.redbubble.com/i/t-shirt/Bloodborne-caryll-runes-by-DigitalCleo/17366943.FB110
stutz bearcat shirt hoodie sticker decal mask classic shirt,https://www.redbubble.com/i/t-shirt/Stutz-bearcat-Shirt-Hoodie-Sticker-Decal-Mask-by-TheScrambler/21994303.IJ6L0
cosmic sound classic shirt,https://www.redbubble.com/i/t-shirt/Cosmic-Sound-by-buko/38774277.QUQES
maga mpga make prison great trump classic shirt,https://www.redbubble.com/i/t-shirt/MAGA-MPGA-make-prison-great-again-trump-2024-by-estudio3e/143688134.XNZKR
normal men classic shirt,https://www.redbubble.com/i/t-shirt/We-re-Just-Normal-Men-by-itsaduckblur/140741011.IJ6L0
cyberpunk samurai demon mask japanese girl classic shirt,https://www.redbubble.com/i/t-shirt/Cyberpunk-Samurai-Demon-Mask-Japanese-Girl-by-OWLvision33/55489598.IJ6L0
died essential shirt,https://www.redbubble.com/i/t-shirt/YOU-DIED-by-TwistedBeard/21329295.FB110
coffee stats tabletop rpg addict essential shirt,https://www.redbubble.com/i/t-shirt/Coffee-Stats-Tabletop-RPG-Addict-by-pixeptional/29450144.FB110
x file want believe essential shirt,https://www.redbubble.com/i/t-shirt/The-X-Files-I-Want-To-Believe-by-oxygold/23853708.FB110
ashley schaeffer let boy watch classic shirt,https://www.redbubble.com/i/t-shirt/Ashley-Schaeffer-Let-The-Boy-Watch-by-RandomWeird/76845156.IJ6L0
vintage th birthday gift essential shirt,https://www.redbubble.com/i/t-shirt/Vintage-1983-40th-Birthday-Gift-by-RicardoTito/39702491.FB110
bad running classic shirt,https://www.redbubble.com/i/t-shirt/It-s-Bad-We-re-Running-by-Chyanime/43068838.22W0K
elephant splash classic shirt,https://www.redbubble.com/i/t-shirt/Elephant-Splash-by-nicebleed/14228141.IJ6L0
fairy tale forest fox bear raccoon owl rabbit flower herb blue background classic shirt,https://www.redbubble.com/i/t-shirt/Fairy-tale-forest-Fox-bear-raccoon-owls-rabbits-flowers-and-herbs-on-a-blue-background-by-Skaska/29532485.S7RYU
dune spice must flow classic shirt,https://www.redbubble.com/i/t-shirt/DUNE-the-spice-must-flow-by-7115/90052263.IJ6L0
boy meme classic shirt,https://www.redbubble.com/i/t-shirt/Me-and-the-Boys-Meme-by-Barnyardy/39331191.WFLAH
queen charlotte george bridgerton sticker classic shirt,https://www.redbubble.com/i/t-shirt/queen-charlotte-and-george-bridgerton-sticker-by-meaganfetch/145436496.WFLAH
wreak havoc essential shirt,https://www.redbubble.com/i/t-shirt/Off-To-Wreak-Havoc-by-wytrab8/102086220.FB110
blood blood god skull skull throne print classic shirt,https://www.redbubble.com/i/t-shirt/Blood-For-The-Blood-God-Skulls-For-The-Skull-Throne-Print-by-ToplineDesigns/74939417.IJ6L0
fine classic shirt,https://www.redbubble.com/i/t-shirt/I-m-Fine-by-ilustrata/35702382.IJ6L0
watercolor vintage floral motif classic shirt,https://www.redbubble.com/i/t-shirt/Watercolor-vintage-floral-motifs-by-Anutina/11696419.WFLAH
central intelligence unicorn faded worn film bob stone essential shirt,https://www.redbubble.com/i/t-shirt/Central-Intelligence-Unicorn-Faded-as-worn-in-the-film-Bob-Stone-by-phunknomenon/22474573.M4A2N
emil classic shirt,https://www.redbubble.com/i/t-shirt/Emil-by-AlundrART/61441979.IJ6L0
trump classic shirt,https://www.redbubble.com/i/t-shirt/Trump-2024-by-mjdgop97/62369396.WFLAH
atreides gradient essential shirt,https://www.redbubble.com/i/t-shirt/Atreides-Gradient-by-splode/56114480.UIIS2
chill like cat classic shirt,https://www.redbubble.com/i/t-shirt/How-to-Chill-Like-a-Cat-by-micklyn/10140564.S7RYU
back future biff auto detailing essential shirt,https://www.redbubble.com/i/t-shirt/Back-To-The-Future-Biff-s-Auto-Detailing-by-movie-shirts/21813350.UIIS2
woman regular fit black cotton blend trouser,https://www.flipkart.com/lee-tex-regular-fit-women-black-trousers/p/itme21873a951c47?pid=TROGHKK6SJVGGNQB&lid=LSTTROGHKK6SJVGGNQBAGCVBI&marketplace=FLIPKART&q=clothing&store=clo&srno=s_1_1&otracker=search&fm=organic&iid=en_fqGbglqncEMinJxjhiEPidFQLkwV7vC89OCS1SIG9rSvb1hMl1DDoN2FWyhnn%2By1MlNgG7TJlusF%2FoQP0bWTRA%3D%3D&ppt=None&ppn=None&ssid=yrkrmveq340000001684690400939&qH=50cf19912960f654
pack men solid black grey track pant,https://www.flipkart.com/vebnor-solid-men-black-grey-track-pants/p/itmea1098f6f1b58?pid=TKPGCG42S6GU8PB4&lid=LSTTKPGCG42S6GU8PB4XWPDGC&marketplace=FLIPKART&q=clothing&store=clo&srno=s_1_2&otracker=search&fm=organic&iid=en_fqGbglqncEMinJxjhiEPidFQLkwV7vC89OCS1SIG9rReAWSS5cSgV6yzR3BD27deWOGuQ8i0WY8AhaK5FFW0fA%3D%3D&ppt=None&ppn=None&ssid=yrkrmveq340000001684690400939&qH=50cf19912960f654
unstitched polyester shirt fabric printed,https://www.flipkart.com/2ni8-lifestyle-polyester-printed-shirt-fabric/p/itmb4fb676d8d8d2?pid=FABGH92SHD2QFXKH&lid=LSTFABGH92SHD2QFXKHGOIJNH&marketplace=FLIPKART&q=clothing&store=clo&srno=s_1_3&otracker=search&fm=organic&iid=31cd8640-dfc8-4931-8cf2-1d362ead6ca3.FABGH92SHD2QFXKH.SEARCH&ppt=None&ppn=None&ssid=yrkrmveq340000001684690400939&qH=50cf19912960f654
unstitched polycotton shirt trouser fabric solid,https://www.flipkart.com/raymond-polycotton-solid-shirt-trouser-fabric/p/itmfb792eb539904?pid=FABGGP2JFFZPFHHG&lid=LSTFABGGP2JFFZPFHHGWJTKUL&marketplace=FLIPKART&q=clothing&store=clo&srno=s_1_4&otracker=search&fm=organic&iid=31cd8640-dfc8-4931-8cf2-1d362ead6ca3.FABGGP2JFFZPFHHG.SEARCH&ppt=None&ppn=None&ssid=yrkrmveq340000001684690400939&qH=50cf19912960f654
unstitched polycotton shirt fabric printed,https://www.flipkart.com/idisi-polycotton-printed-shirt-fabric/p/itm156e85ccc61cf?pid=SHTGEPYJUCQ4QSSU&lid=LSTSHTGEPYJUCQ4QSSUGBREQ3&marketplace=FLIPKART&q=clothing&store=clo&srno=s_1_5&otracker=search&fm=organic&iid=31cd8640-dfc8-4931-8cf2-1d362ead6ca3.SHTGEPYJUCQ4QSSU.SEARCH&ppt=None&ppn=None&ssid=yrkrmveq340000001684690400939&qH=50cf19912960f654
unstitched cotton blend shirt fabric solid,https://www.flipkart.com/sjy-cotton-blend-solid-shirt-fabric/p/itm818e1011d9868?pid=FABGAQUW9CFQWMGD&lid=LSTFABGAQUW9CFQWMGD0QCRWP&marketplace=FLIPKART&q=clothing&store=clo&srno=s_1_6&otracker=search&fm=organic&iid=31cd8640-dfc8-4931-8cf2-1d362ead6ca3.FABGAQUW9CFQWMGD.SEARCH&ppt=None&ppn=None&ssid=yrkrmveq340000001684690400939&qH=50cf19912960f654
unstitched viscose rayon trouser fabric solid,https://www.flipkart.com/raymond-viscose-rayon-solid-trouser-fabric/p/itm5d891193b610b?pid=FABFTK7WASTF2YGR&lid=LSTFABFTK7WASTF2YGRFLIUFW&marketplace=FLIPKART&q=clothing&store=clo&srno=s_1_7&otracker=search&fm=organic&iid=31cd8640-dfc8-4931-8cf2-1d362ead6ca3.FABFTK7WASTF2YGR.SEARCH&ppt=None&ppn=None&ssid=yrkrmveq340000001684690400939&qH=50cf19912960f654
pack men solid dark blue grey track pant,https://www.flipkart.com/vebnor-solid-men-dark-blue-grey-track-pants/p/itm3549a320adb9e?pid=TKPGCJYGMAHMBQ8Y&lid=LSTTKPGCJYGMAHMBQ8Y6TDQQJ&marketplace=FLIPKART&q=clothing&store=clo&srno=s_1_8&otracker=search&fm=organic&iid=en_fqGbglqncEMinJxjhiEPidFQLkwV7vC89OCS1SIG9rQKtJzktaZaAwrp3Lx3CjC9RdS%2FLCq1rHZp3YMeNPyf%2FA%3D%3D&ppt=None&ppn=None&ssid=yrkrmveq340000001684690400939&qH=50cf19912960f654
unstitched viscose rayon shirt fabric printed,https://www.flipkart.com/hk-fashion-viscose-rayon-printed-shirt-fabric/p/itmc85c2763bc4ef?pid=FABGDAMP9WSNSVEF&lid=LSTFABGDAMP9WSNSVEF3SEAMQ&marketplace=FLIPKART&q=clothing&store=clo&srno=s_1_9&otracker=search&fm=organic&iid=31cd8640-dfc8-4931-8cf2-1d362ead6ca3.FABGDAMP9WSNSVEF.SEARCH&ppt=None&ppn=None&ssid=yrkrmveq340000001684690400939&qH=50cf19912960f654
unstitched polyester shirt trouser fabric solid checkered,https://www.flipkart.com/jhabak-s-polyester-solid-checkered-shirt-trouser-fabric/p/itm549e3e591a027?pid=FABGCAZ37KCW2FKB&lid=LSTFABGCAZ37KCW2FKBLDF7TH&marketplace=FLIPKART&q=clothing&store=clo&srno=s_1_10&otracker=search&fm=organic&iid=31cd8640-dfc8-4931-8cf2-1d362ead6ca3.FABGCAZ37KCW2FKB.SEARCH&ppt=None&ppn=None&ssid=yrkrmveq340000001684690400939&qH=50cf19912960f654
men woman solid ankle length,https://www.flipkart.com/krijo-men-women-solid-ankle-length/p/itm6b6329bf9b1d9?pid=SOCGGCPYJZP7YHUG&lid=LSTSOCGGCPYJZP7YHUGV9GVEL&marketplace=FLIPKART&q=clothing&store=clo&srno=s_1_11&otracker=search&fm=organic&iid=en_fqGbglqncEMinJxjhiEPidFQLkwV7vC89OCS1SIG9rTbppTnE2J8EohwsyA5CrRtF3I7TaCjwUOBS8sMH4SETg%3D%3D&ppt=None&ppn=None&ssid=yrkrmveq340000001684690400939&qH=50cf19912960f654
baby boy printed cotton blend shirt,https://www.flipkart.com/atlans-clothes-baby-boys-printed-cotton-blend-t-shirt/p/itm87c24ca923566?pid=KTBGZ7X65YVXGZFA&lid=LSTKTBGZ7X65YVXGZFAWRV1GM&marketplace=FLIPKART&q=clothing&store=clo&srno=s_1_12&otracker=search&fm=organic&iid=en_fqGbglqncEMinJxjhiEPidFQLkwV7vC89OCS1SIG9rSFV6J1YaK%2FeSnhUlvGrkx6vDvVdPCciJ5kIRurSnccew%3D%3D&ppt=None&ppn=None&ssid=yrkrmveq340000001684690400939&qH=50cf19912960f654
men solid ankle length,https://www.flipkart.com/swagr-men-solid-ankle-length/p/itm1fe69dec7d2be?pid=SOCGGNX58KHMSDMZ&lid=LSTSOCGGNX58KHMSDMZR1EHCD&marketplace=FLIPKART&q=clothing&store=clo&spotlightTagId=BestsellerId_clo&srno=s_1_13&otracker=search&fm=organic&iid=31cd8640-dfc8-4931-8cf2-1d362ead6ca3.SOCGGNX58KHMSDMZ.SEARCH&ppt=None&ppn=None&ssid=yrkrmveq340000001684690400939&qH=50cf19912960f654
men printed typography round neck grey shirt,https://www.flipkart.com/roadster-printed-typography-men-round-neck-grey-t-shirt/p/itm2ce7de550bdee?pid=TSHFGHCP7Z2VZSCK&lid=LSTTSHFGHCP7Z2VZSCKRZIKYE&marketplace=FLIPKART&q=clothing&store=clo&srno=s_1_14&otracker=search&fm=organic&iid=31cd8640-dfc8-4931-8cf2-1d362ead6ca3.TSHFGHCP7Z2VZSCK.SEARCH&ppt=None&ppn=None&ssid=yrkrmveq340000001684690400939&qH=50cf19912960f654
men solid polo neck green shirt,https://www.flipkart.com/3bros-solid-men-polo-neck-green-t-shirt/p/itmd0551940a1b12?pid=TSHGBBN9PMESF2AK&lid=LSTTSHGBBN9PMESF2AKW8Z4DZ&marketplace=FLIPKART&q=clothing&store=clo&srno=s_1_15&otracker=search&fm=organic&iid=31cd8640-dfc8-4931-8cf2-1d362ead6ca3.TSHGBBN9PMESF2AK.SEARCH&ppt=None&ppn=None&ssid=yrkrmveq340000001684690400939&qH=50cf19912960f654
