description,url
zach bryan quiet heavy dream classic shirt,https://www.redbubble.com/i/t-shirt/Zach-Bryan-Quiet-Heavy-Dreams-by-SkyAfterDusk/112372058.QUQES.XYZ
space dog classic shirt,https://www.redbubble.com/i/t-shirt/Space-dogs-by-celestecia/23467022.QUQES.XYZ
cool binary tree coding computer science shirt gift woman men classic shirt,https://www.redbubble.com/i/t-shirt/Cool-Binary-Tree-Coding-Computer-Science-T-Shirts-Gifts-for-Women-Men-by-Anna0908/29724117.IJ6L0.XYZ
bird sits wish classic shirt,https://www.redbubble.com/i/t-shirt/Bird-sits-where-he-wishes-by-StirfrySisi/144963295.WFLAH.XYZ
team jacob cursed fan collage classic shirt,https://www.redbubble.com/i/t-shirt/Team-Jacob-Cursed-Fan-Collage-by-snazzyseagull/140006672.IJ6L0.XYZ
let make brownie lightweight hoodie,https://www.redbubble.com/i/hoodie/Let-s-Make-Brownies-by-stevenrhodes/33991975.MAO2B.XYZ
retro gaming machine lightweight hoodie,https://www.redbubble.com/i/hoodie/Retro-gaming-machine-by-ilustrata/33887504.Z4UL5.XYZ
vintage muppet show essential shirt,https://www.redbubble.com/i/t-shirt/Vintage-Muppet-Show-by-BrokenHorn/26072874.6ATOD.XYZ
music classic shirt,https://www.redbubble.com/i/t-shirt/Music-by-ThinkyPain/13499730.IJ6L0.XYZ
foiled essential shirt,https://www.redbubble.com/i/t-shirt/Foiled-Again-by-rebekieb/10399808.6ATOD.XYZ
tech support classic shirt,https://www.redbubble.com/i/t-shirt/I-m-from-tech-support-by-OffensiveFun/24188248.WFLAH.XYZ
linear light classic shirt,https://www.redbubble.com/i/t-shirt/Linear-Light-by-thepapercrane/28811065.IJ6L0.XYZ
tatooine classic shirt,https://www.redbubble.com/i/t-shirt/Tatooine-by-floresarts/20444237.WFLAH.XYZ
achieve dream lightweight sweatshirt,https://www.redbubble.com/i/sweatshirt/Achieve-Your-Dreams-by-stevenrhodes/30602527.NUC7A.XYZ
great ramen wave classic shirt,https://www.redbubble.com/i/t-shirt/Great-Ramen-Wave-by-vincenttrinidad/31747027.IJ6L0.XYZ
donkey girl love horse parody classic shirt,https://www.redbubble.com/i/t-shirt/Donkey-Just-A-Girl-That-Loves-Horses-Parody-by-snazzyseagull/144950223.WFLAH.XYZ
thomas tank classic shirt,https://www.redbubble.com/i/t-shirt/Thomas-The-Tank-by-FrederickJay/33885425.22W0K.XYZ
cat murderous black cat knife gift premium shirt classic shirt,https://www.redbubble.com/i/t-shirt/Cat-What-Murderous-Black-Cat-With-Knife-Gift-Premium-T-Shirt-by-ZeLittleFamily/43523705.WFLAH.XYZ
cyberpunk vaporwave japanese classic shirt,https://www.redbubble.com/i/t-shirt/Cyberpunk-Vaporwave-Japanese-by-OWLvision33/55417587.WFLAH.XYZ
jasmine dragon tea house classic shirt,https://www.redbubble.com/i/t-shirt/Jasmine-Dragon-Tea-House-by-vintage-pete/53353107.QUQES.XYZ
shark classic shirt,https://www.redbubble.com/i/t-shirt/Sharks-by-AmyHamilton/13998564.WFLAH.XYZ
book dinosaur classic shirt,https://www.redbubble.com/i/t-shirt/BOOK-DINOSAURS-01-by-bonniepangart/25577606.S7RYU.XYZ
boomstick graphic shirt dress,https://www.redbubble.com/i/dress/This-is-my-Boomstick-by-therocketman/28551751.TGIUM
true vintage racer essential shirt,https://www.redbubble.com/i/t-shirt/True-vintage-racer-2-by-Subspeed/37426528.BTWM1.XYZ
trash trash wholesome cute raccoon meme classic shirt,https://www.redbubble.com/i/t-shirt/it-s-trash-CAN-not-trash-CAN-T-wholesome-cute-raccoon-meme-by-snazzyseagull/144576121.IJ6L0.XYZ
like cat coffee maybe people classic shirt,https://www.redbubble.com/i/t-shirt/I-Like-cats-And-Coffee-And-Maybe-3-People-by-adam07/58852391.IJ6L0.XYZ
eat nut allergic nut allergy classic shirt,https://www.redbubble.com/i/t-shirt/I-can-t-eat-nuts-I-m-allergic-nut-allergy-by-snazzyseagull/143813345.IJ6L0.XYZ
frog toad classic shirt,https://www.redbubble.com/i/t-shirt/Frog-and-Toad-by-ruthierue/50592676.WFLAH.XYZ
hoptopus beer drinking octopus classic shirt,https://www.redbubble.com/i/t-shirt/Hoptopus-The-Beer-Drinking-Octopus-by-HabbyArt/48700135.QUQES.XYZ
dance devil classic shirt,https://www.redbubble.com/i/t-shirt/Dance-with-the-Devil-by-TheWhiteBear/23399243.WFLAH.XYZ
furby existence pain classic shirt,https://www.redbubble.com/i/t-shirt/Furby-Existence-is-Pain-by-snazzyseagull/141481096.IJ6L0.XYZ
adopt familiar classic shirt,https://www.redbubble.com/i/t-shirt/Adopt-A-Familiar-by-stevenrhodes/79301765.IJ6L0.XYZ
idea classic shirt,https://www.redbubble.com/i/t-shirt/I-have-no-idea-what-I-m-doing-by-chestify/34993927.IJ6L0.XYZ
tatooine sun classic shirt,https://www.redbubble.com/i/t-shirt/TATOOINE-SUN-by-yellowmadcat/35312568.WFLAH.XYZ
goku riding motocycle dragon ball classic shirt,https://www.redbubble.com/i/t-shirt/Goku-Riding-a-motocycle-Dragon-Ball-by-dystopix/76696722.WFLAH.XYZ
scranton electric city classic shirt,https://www.redbubble.com/i/t-shirt/Scranton-The-Electric-City-by-boboman13/47668180.IJ6L0.XYZ
kinkaku ji premium scoop shirt,https://www.redbubble.com/i/t-shirt/Kinkaku-ji-by-DMDesigns20/145196577.07KN2
gay trying murder classic shirt,https://www.redbubble.com/i/t-shirt/these-gays-they-are-trying-to-murder-me-by-naiverider/135515383.WFLAH.XYZ
surely everybody kung fu fighting essential shirt,https://www.redbubble.com/i/t-shirt/Surely-Not-Everybody-Was-Kung-Fu-Fighting-by-kjanedesigns/23569322.BTWM1.XYZ
parker knoll classic shirt,https://www.redbubble.com/i/t-shirt/Parker-Knoll-by-paulusjart/27543158.240QL.XYZ
thistle moth classic shirt,https://www.redbubble.com/i/t-shirt/Thistle-and-moth-by-Laorel/43088284.IJ6L0.XYZ
chillin flamingo tiger classic shirt,https://www.redbubble.com/i/t-shirt/Chillin-Flamingo-Tiger-by-38Sunsets/26317050.WFLAH.XYZ
elwood jake classic shirt,https://www.redbubble.com/i/t-shirt/Elwood-and-Jake-by-thedrumstick/34851612.0S66D.XYZ
yharnam blood vial essential shirt,https://www.redbubble.com/i/t-shirt/Yharnam-s-Blood-Vials-by-wonderjosh3000/27215442.FB110.XYZ
larus marinus classic shirt,https://www.redbubble.com/i/t-shirt/Larus-Marinus-by-thepapercrane/15569359.S7RYU.XYZ
eurovision finland k rij cha cha cha classic shirt,https://www.redbubble.com/i/t-shirt/Eurovision-2023-Finland-K%C3%A4%C3%A4rij%C3%A4-Cha-Cha-Cha-by-humnoo/142171790.IJ6L0.XYZ
barnabus classic shirt,https://www.redbubble.com/i/t-shirt/Barnabus-by-opifan/11500293.WFLAH.XYZ
retro flower vintage style floral pattern thulian pink orange mustard cream sleeveless top,https://www.redbubble.com/i/top/Retro-60s-70s-Flowers-Vintage-Style-Floral-Pattern-in-Thulian-Pink-Orange-Mustard-and-Cream-by-kierkegaard/76496066.6AQD3
hattori hanzo line dress,https://www.redbubble.com/i/dress/Hattori-Hanzo-by-NinoMelon/26907137.V4WQ8
kame house beach club classic shirt,https://www.redbubble.com/i/t-shirt/Kame-House-Beach-Club-by-TravisPixels/52625305.240QL.XYZ
rick astley president essential shirt,https://www.redbubble.com/i/t-shirt/Rick-Astley-For-President-by-kjanedesigns/23625613.NL9AC.XYZ
starry night mountain classic shirt,https://www.redbubble.com/i/t-shirt/Starry-Night-in-the-Mountains-by-ndtank/14488649.QUQES.XYZ
neon genesis evangelion retro vintage essential shirt,https://www.redbubble.com/i/t-shirt/Neon-Genesis-Evangelion-Retro-Vintage-by-Teebuya/62800761.FB110.XYZ
death ride black cat classic shirt,https://www.redbubble.com/i/t-shirt/Death-Rides-A-Black-Cat-by-obinsun/28571846.IJ6L0.XYZ
odin essential shirt,https://www.redbubble.com/i/t-shirt/ODIN-by-RAIDHO/14523914.FB110.XYZ
little fat bird sitting sparrow green illustration classic shirt,https://www.redbubble.com/i/t-shirt/Little-Fat-Bird-Sitting-Sparrow-Green-Illustration-by-GingerandMilk/145368478.WFLAH.XYZ
kata classic shirt,https://www.redbubble.com/i/t-shirt/What-s-your-Kata-by-THEILO/63129955.IJ6L0.XYZ
los jibbities original classic shirt,https://www.redbubble.com/i/t-shirt/Los-Jibbities-Original-by-Dezthelez/79620770.IJ6L0.XYZ
red dwarf london jet classic shirt,https://www.redbubble.com/i/t-shirt/Red-Dwarf-London-Jets-by-UnconArt/28029133.XNZKR.XYZ
winner classic shirt,https://www.redbubble.com/i/t-shirt/The-winner-by-soltib/11777093.WFLAH.XYZ
cast fireball wizard sorcerer dm gift ttrpg classic shirt,https://www.redbubble.com/i/t-shirt/I-cast-Fireball-Wizard-Sorcerer-DM-Gift-TTRPG-by-hayseedbyte/42221167.IJ6L0.XYZ
raccoon wielding ukulele classic shirt,https://www.redbubble.com/i/t-shirt/Raccoon-wielding-ukulele-by-autoboxdesign/28659732.WFLAH.XYZ
pride tree life classic shirt,https://www.redbubble.com/i/t-shirt/Pride-tree-of-life-by-EllyBurg/81245057.9V5H1.XYZ
grumpy frog matsumoto hoji classic shirt,https://www.redbubble.com/i/t-shirt/Grumpy-Frog-Matsumoto-Hoji-by-nphindenberg/57170597.QUQES.XYZ
paused game essential shirt,https://www.redbubble.com/i/t-shirt/I-Paused-My-Game-To-Be-Here-by-keepers/31411444.BTWM1.XYZ
raven classic shirt,https://www.redbubble.com/i/t-shirt/Raven-by-Nicklas81/11425673.WFLAH.XYZ
jesus meme saw classic shirt,https://www.redbubble.com/i/t-shirt/Jesus-Meme-I-Saw-That-by-Beltschazar/45708318.IJ6L0.XYZ
honk essential shirt,https://www.redbubble.com/i/t-shirt/HONK-by-Eilex-Design/41741437.UIIS2.XYZ
dungeon dragon classic shirt,https://www.redbubble.com/i/t-shirt/Dungeons-and-Dragons-1974-by-AstroZombie6669/66773725.XNZKR.XYZ
holy bibble classic shirt,https://www.redbubble.com/i/t-shirt/The-Holy-Bibble-by-snazzyseagull/143965637.S7RYU.XYZ
dr teeth classic shirt,https://www.redbubble.com/i/t-shirt/Dr-Teeth-by-victor-calahan/36167887.VL7OD.XYZ
god war ragnar k comic book cover fan art classic shirt,https://www.redbubble.com/i/t-shirt/God-of-War-Ragnar%C3%B6k-Comic-book-cover-Fan-Art-by-MarkScicluna/110042920.S7RYU.XYZ
librarian horde line dress,https://www.redbubble.com/i/dress/The-Librarians-Horde-by-rebekieb/23071230.V4WQ8
let eat trash get hit car essential shirt,https://www.redbubble.com/i/t-shirt/Let-s-Eat-Trash-Get-Hit-By-A-Car-by-Desginfirst/52965834.FB110.XYZ
litany fear classic shirt,https://www.redbubble.com/i/t-shirt/Litany-Against-Fear-by-robertpartridge/18279086.IJ6L0.XYZ
defense left unsupervised lightweight hoodie,https://www.redbubble.com/i/hoodie/In-my-defense-I-was-left-unsupervised-by-chestify/35016188.O6XP1.XYZ
adventurer cat lightweight hoodie,https://www.redbubble.com/i/hoodie/Adventurer-Cat-by-clingcling/13136761.O6XP1.XYZ
magic mushroom buddha pullover hoodie,https://www.redbubble.com/i/hoodie/Magic-Mushroom-Buddha-by-underheaven/42267800.YFBT8.XYZ
anor londo archery club essential shirt,https://www.redbubble.com/i/t-shirt/ANOR-LONDO-ARCHERY-CLUB-by-TwistedBeard/21747189.FB110.XYZ
drink coffee hate people know thing cat lover gift essential shirt,https://www.redbubble.com/i/t-shirt/That-s-What-I-Do-I-Drink-Coffee-I-Hate-People-And-I-Know-Things-Cat-Lover-Gifts-by-moonchildworld/53997571.FB110.XYZ
black metal pinhead essential shirt,https://www.redbubble.com/i/t-shirt/Black-Metal-Pinhead-by-samRAW08/21446043.FB110.XYZ
horror house classic shirt,https://www.redbubble.com/i/t-shirt/Horror-House-by-dooomcat/41574531.QUQES.XYZ
cowboy raccoon word art classic shirt,https://www.redbubble.com/i/t-shirt/cowboy-raccoon-word-art-by-snazzyseagull/144190815.S7RYU.XYZ
guess die vintage funny dnd tabletop classic shirt,https://www.redbubble.com/i/t-shirt/Guess-I-ll-Die-D20-Vintage-Funny-DnD-Tabletop-by-monsterclub/46212611.IJ6L0.XYZ
golden dragon classic shirt,https://www.redbubble.com/i/t-shirt/Golden-dragon-by-RallraxAuri/143971377.WFLAH.XYZ
turbo classic shirt,https://www.redbubble.com/i/t-shirt/480-turbo-by-Gallego83/144955175.WFLAH.XYZ
world best cook walter white breaking bad design classic shirt,https://www.redbubble.com/i/t-shirt/World-s-Best-Cook-Walter-White-Breaking-Bad-Design-by-snazzyseagull/140383920.IJ6L0.XYZ
thing classic shirt,https://www.redbubble.com/i/t-shirt/thing-by-I-got-red-on-me/23985713.S7RYU.XYZ
satriale pullover hoodie,https://www.redbubble.com/i/hoodie/Satriale-s-by-jordan5L/44233003.VR8OC.XYZ
princess diana jungkook retro meme classic shirt,https://www.redbubble.com/i/t-shirt/Princess-Diana-Jungkook-retro-meme-by-snazzyseagull/142306608.WFLAH.XYZ
lonely dragon classic shirt,https://www.redbubble.com/i/t-shirt/Lonely-dragon-by-AlvaDesigns/71029126.QUQES.XYZ
plumber snek classic shirt,https://www.redbubble.com/i/t-shirt/Plumber-Snek-by-CassandraDayArt/144804884.240QL.XYZ
vintage mcrn uniform classic shirt,https://www.redbubble.com/i/t-shirt/Vintage-MCRN-Uniform-by-kg07/71027030.IJ6L0.XYZ
fat chocobo ramen classic shirt,https://www.redbubble.com/i/t-shirt/Fat-Chocobo-Ramen-by-AlundrART/86192521.IJ6L0.XYZ
vi lover racerback tank top,https://www.redbubble.com/i/tank-top/VI-The-Lovers-by-deniart/42853840.IXNXQ
frog son classic shirt,https://www.redbubble.com/i/t-shirt/A-Frog-and-His-Son-by-DingHuArt/57352076.0S66D.XYZ
seal approval essential shirt,https://www.redbubble.com/i/t-shirt/Seal-of-Approval-by-jaffajam/14042351.UIIS2.XYZ
pizza kong racerback tank top,https://www.redbubble.com/i/tank-top/Pizza-Kong-by-ilustrata/28197978.IXNXQ
stranger thing hellfire club logo essential shirt,https://www.redbubble.com/i/t-shirt/Stranger-Things-4-Hellfire-Club-Logo-by-FifthSun/122402835.NL9AC.XYZ
enchanting vinyl record vintage essential shirt,https://www.redbubble.com/i/t-shirt/Enchanting-Vinyl-Records-Vintage-by-ddtk/6301078.CW2C9.XYZ
graphic design passion word art classic shirt,https://www.redbubble.com/i/t-shirt/Graphic-Design-is-my-passion-word-art-by-snazzyseagull/144612689.IJ6L0.XYZ
vetruvian rock star classic shirt,https://www.redbubble.com/i/t-shirt/Vetruvian-Rock-Star-by-bonedesigns/18876645.IJ6L0.XYZ
science sided dice classic shirt,https://www.redbubble.com/i/t-shirt/The-science-of-20-sided-dice-by-graffd02/22627637.IJ6L0.XYZ
visit arrakis classic shirt,https://www.redbubble.com/i/t-shirt/Visit-Arrakis-by-heavyhand/8151588.7KE4Y.XYZ
tatooine national park twice fun twice fun classic shirt,https://www.redbubble.com/i/t-shirt/Tatooine-National-Park-Twice-the-Fun-Twice-the-Fun-by-magrodanny/93699591.IJ6L0.XYZ
evangelion eva classic shirt,https://www.redbubble.com/i/t-shirt/Evangelion-Eva-by-TheWiredStore/68062112.WFLAH.XYZ
bear country classic shirt,https://www.redbubble.com/i/t-shirt/Bear-Country-by-thepapercrane/16658855.IJ6L0.XYZ
alien radiography x ray classic shirt,https://www.redbubble.com/i/t-shirt/Alien-Radiography-X-Ray-by-camikaze-es/49812557.IJ6L0.XYZ
defense left unsupervised essential shirt,https://www.redbubble.com/i/t-shirt/In-my-defense-I-was-left-unsupervised-by-digerati/20973742.FB110.XYZ
sun worshipper classic shirt,https://www.redbubble.com/i/t-shirt/Sun-Worshipper-by-thepapercrane/23157441.7H7A9.XYZ
fullmetal alchemist flamel legging,https://www.redbubble.com/i/leggings/FullMetal-Alchemist-Flamel-by-RevolutionGFX/10335945.7DWO7
rainbow music cat essential shirt,https://www.redbubble.com/i/t-shirt/Rainbow-Music-Cat-by-robotface/25569898.FB110.XYZ
catzilla vintage essential shirt,https://www.redbubble.com/i/t-shirt/Catzilla-vintage-by-Le-Freak/79716759.FB110.XYZ
eat green classic shirt,https://www.redbubble.com/i/t-shirt/Eat-Your-Greens-by-stevenrhodes/56604705.1482B.XYZ
funny mango tshirt classic shirt,https://www.redbubble.com/i/t-shirt/Funny-Mango-Tshirt-by-rott515/17305595.WFLAH.XYZ
christian mom bigweld classic shirt,https://www.redbubble.com/i/t-shirt/Christian-Mom-against-BIGWELD-by-CandyAcid/59985104.WFLAH.XYZ
fear wheel classic shirt,https://www.redbubble.com/i/t-shirt/Fears-Wheel-by-RustyQuill/72289588.QUQES.XYZ
american shorthair happy essential shirt,https://www.redbubble.com/i/t-shirt/American-Shorthair-happy-by-sanogawa/10435061.NL9AC.XYZ
trans right human right classic shirt,https://www.redbubble.com/i/t-shirt/Trans-Rights-are-Human-Rights-2-1-by-Thelittlelord/75015454.IJ6L0.XYZ
escher classic shirt,https://www.redbubble.com/i/t-shirt/80-s-Escher-by-thepapercrane/47063431.WFLAH.XYZ
swedish folk cat classic shirt,https://www.redbubble.com/i/t-shirt/Swedish-Folk-Cats-by-kostolom3000/27673864.22W0K.XYZ
avocado yoga classic shirt,https://www.redbubble.com/i/t-shirt/Avocado-Yoga-by-Huebucket/30758253.WFLAH.XYZ
vinyl record collection line dress,https://www.redbubble.com/i/dress/Vinyl-Record-Collection-by-daisy-beatrice/25883697.V4WQ8
dandylion people flight essential shirt,https://www.redbubble.com/i/t-shirt/Dandylion-People-Flight-by-zomboy/1373162.NL9AC.XYZ
era classic shirt,https://www.redbubble.com/i/t-shirt/ALL-ERAS-by-marianaavilal/144993355.WFLAH.XYZ
king trash active shirt,https://www.redbubble.com/i/t-shirt/King-of-Trash-by-thiagocorream/77809454.UGYPM.XYZ
endor national park home ewoks classic shirt,https://www.redbubble.com/i/t-shirt/Endor-National-Park-Home-of-the-Ewoks-by-magrodanny/113451080.IJ6L0.XYZ
linear landscape classic shirt,https://www.redbubble.com/i/t-shirt/Linear-Landscape-by-thepapercrane/16796354.S7RYU.XYZ
oil union vintage essential shirt,https://www.redbubble.com/i/t-shirt/76-Oil-Union-Vintage-by-quark/39242696.UIIS2.XYZ
cat got soul classic shirt,https://www.redbubble.com/i/t-shirt/Cat-Got-Your-Soul-by-obinsun/14865964.IJ6L0.XYZ
ew people active shirt,https://www.redbubble.com/i/t-shirt/Ew-People-by-chestify/29205512.UGYPM.XYZ
come mr bubble classic shirt,https://www.redbubble.com/i/t-shirt/Come-on-Mr-Bubbles-by-filiskun/38760280.S7RYU.XYZ
threat level midnight classic shirt,https://www.redbubble.com/i/t-shirt/Threat-Level-Midnight-by-Flakey/62956296.IJ6L0.XYZ
spirit animal cat classic shirt,https://www.redbubble.com/i/t-shirt/Spirit-Animal-Cat-by-dandingeroz/37660799.QUQES.XYZ
hazard classic shirt,https://www.redbubble.com/i/t-shirt/1996-Hazard-by-DemonigoteCamis/50821537.IJ6L0.XYZ
sunset sarsaparilla classic shirt,https://www.redbubble.com/i/t-shirt/Sunset-Sarsaparilla-by-Industrie/46896265.2EZFS.XYZ
vert der ferk cook swedish chef funny tshirt saying men woman essential shirt,https://www.redbubble.com/i/t-shirt/Vert-Der-Ferk-cook-Swedish-Chef-Funny-tshirt-2019-saying-Men-Women-by-Jessicabowdich/36232342.FB110.XYZ
fur antidepressant cute black cat illustration gift pet lover classic shirt,https://www.redbubble.com/i/t-shirt/FUR-ANTIDEPRESSANT-Cute-black-cat-illustration-A-gift-for-a-pet-lover-by-kostolom3000/11822669.0S66D.XYZ
funny music lover gift bicycle costume want classic shirt,https://www.redbubble.com/i/t-shirt/Funny-Music-lover-Gift-Bicycle-Costume-I-Want-It-All-by-The1Tee/46671078.IJ6L0.XYZ
wait classic shirt,https://www.redbubble.com/i/t-shirt/Wait-What-by-ironydesigns/14228197.QUQES.XYZ
beetle classic shirt,https://www.redbubble.com/i/t-shirt/The-Beetles-by-JPUnsolicited/29752466.0S66D.XYZ
epic fight classic shirt,https://www.redbubble.com/i/t-shirt/Epic-Fight-by-kg07/60973424.IJ6L0.XYZ
blazing fox tree racerback tank top,https://www.redbubble.com/i/tank-top/Blazing-Fox-Tree-by-38Sunsets/26316312.IXNXQ
pew pew pew classic shirt,https://www.redbubble.com/i/t-shirt/Pew-Pew-Pew-by-Purakushi/31256685.IJ6L0.XYZ
bad girl coven owl house relaxed fit shirt,https://www.redbubble.com/i/t-shirt/Bad-Girl-Coven-The-Owl-House-by-Sharkanakronism/45988516.HCZMZ
scream christmas mini skirt,https://www.redbubble.com/i/skirt/The-Scream-Before-Christmas-by-nicebleed/23639605.MUCKM
cucco farm essential shirt,https://www.redbubble.com/i/t-shirt/Cucco-Farms-by-Swainathan/31113783.UIIS2.XYZ
ah element surprise essential shirt,https://www.redbubble.com/i/t-shirt/Ah-The-element-of-surprise-by-squidyes/9694025.FB110.XYZ
hey fixed banksy shredded balloon girl essential shirt,https://www.redbubble.com/i/t-shirt/Hey-I-Fixed-It-Banksy-Shredded-Balloon-Girl-by-japdua/34371704.FB110.XYZ
sushi hug classic shirt,https://www.redbubble.com/i/t-shirt/Sushi-Hug-by-andremuller/27960296.WFLAH.XYZ
vintage plague doctor classic shirt,https://www.redbubble.com/i/t-shirt/Vintage-Plague-Doctor-by-RavenWake/45988705.IJ6L0.XYZ
unknown pleasure classic shirt,https://www.redbubble.com/i/t-shirt/Unknown-Pleasures-by-arkitekta/31844246.IJ6L0.XYZ
alice adventure wonderland white rabbit mad hatter legging,https://www.redbubble.com/i/leggings/Alice-s-Adventures-in-Wonderland-White-Rabbit-Mad-Hatter-by-antiqueart/35294454.7DWO7
bloom skull chiffon top,https://www.redbubble.com/i/top/Bloom-Skull-by-aligulec/27848084.B7P0O
jennifer body heart jennifer check original classic shirt,https://www.redbubble.com/i/t-shirt/Jennifer-s-Body-Heart-Jennifer-Check-ORIGINAL-by-thelamehuman/93691156.IJ6L0.XYZ
laszlo nadja album cover classic shirt,https://www.redbubble.com/i/t-shirt/Laszlo-and-Nadja-album-cover-by-harebrained/81543154.QUQES.XYZ
box box box f tyre compound v design classic shirt,https://www.redbubble.com/i/t-shirt/Box-Box-Box-F1-Tyre-Compound-V2-Design-by-davidspeed/66308106.WFLAH.XYZ
hold butt essential shirt,https://www.redbubble.com/i/t-shirt/Hold-on-to-Your-Butts-by-KentZonestar/10489670.FB110.XYZ
fine fine everything fine funny cat essential shirt,https://www.redbubble.com/i/t-shirt/It-s-Fine-I-m-Fine-Everything-Is-Fine-Funny-cat-by-zacben/100071946.I57B7.XYZ
sunnydale bronze classic shirt,https://www.redbubble.com/i/t-shirt/Sunnydale-s-The-Bronze-by-MitchLudwig/27430525.IJ6L0.XYZ
noot noot pingu shirt noot meme gift pingu noot noot motherf classic shirt,https://www.redbubble.com/i/t-shirt/Noot-Noot-Pingu-Shirt-Noot-Meme-Gift-Pingu-Noot-Noot-Motherf-by-monsterclub/40728795.IJ6L0.XYZ
lgbt thin subtle modern rainbow flag black gay lesbian bisexual pride hd high quality online store classic shirt,https://www.redbubble.com/i/t-shirt/LGBT-thin-subtle-modern-rainbow-flag-on-black-Gay-Lesbian-Bisexual-Pride-HD-HIGH-QUALITY-ONLINE-STORE-by-iresist/32111816.IJ6L0.XYZ
synth mountain sunrise classic shirt,https://www.redbubble.com/i/t-shirt/Synth-Mountain-Sunrise-by-forge22/79115165.IJ6L0.XYZ
planet colour lightweight sweatshirt,https://www.redbubble.com/i/sweatshirt/Planets-Colour-by-TPdesigns/19325333.NUC7A.XYZ
ferris bueller classic shirt,https://www.redbubble.com/i/t-shirt/Ferris-Bueller-by-smallbatch/29488638.WFLAH.XYZ
space surfing classic shirt,https://www.redbubble.com/i/t-shirt/Space-Surfing-by-nicebleed/11492201.IJ6L0.XYZ
sci fi planet classic shirt,https://www.redbubble.com/i/t-shirt/Sci-Fi-Planet-by-slvdesign/73792111.IJ6L0.XYZ
callahan auto part classic shirt,https://www.redbubble.com/i/t-shirt/Callahan-Auto-Parts-by-dustbrain/36306852.1482B.XYZ
cristiano haalando classic shirt,https://www.redbubble.com/i/t-shirt/Cristiano-Haalando-by-RoryPaints/145271207.IJ6L0.XYZ
smiling musical fox racerback tank top,https://www.redbubble.com/i/tank-top/Smiling-Musical-Fox-by-38Sunsets/36100767.N283C
style retro vintage mid century line dress,https://www.redbubble.com/i/dress/60s-70s-Style-Retro-Vintage-Mid-Century-by-ImageMonkey/75945837.V4WQ8
dune muad dib classic shirt,https://www.redbubble.com/i/t-shirt/Dune-2020-Muadand-39-Dib-by-SvartInk/58458072.WFLAH.XYZ
fix funny repair man essential shirt,https://www.redbubble.com/i/t-shirt/Can-We-Fix-It-Funny-Repair-Man-by-PinkPlatypus/106337555.FB110.XYZ
dead space fan art comic cover classic shirt,https://www.redbubble.com/i/t-shirt/Dead-Space-fan-art-comic-cover-by-MarkScicluna/99439058.9V5H1.XYZ
keytar platypus venn diagram classic shirt,https://www.redbubble.com/i/t-shirt/Keytar-Platypus-Venn-Diagram-by-GuyBlank/10972629.WFLAH.XYZ
resident evil fan art comic cover classic shirt,https://www.redbubble.com/i/t-shirt/Resident-Evil-4-fan-art-comic-cover-by-MarkScicluna/99061568.22W0K.XYZ
fluffin meowgical essential shirt,https://www.redbubble.com/i/t-shirt/Fluffin-Meowgical-by-wytrab8/29662795.FB110.XYZ
behind mall classic shirt,https://www.redbubble.com/i/t-shirt/behind-the-mall-by-marianaavilal/144843355.22W0K.XYZ
science lightweight hoodie,https://www.redbubble.com/i/hoodie/Science-by-stevenrhodes/29239639.GQV8B.XYZ
kawaii vintage style japenese ramen cat essential shirt,https://www.redbubble.com/i/t-shirt/Kawaii-Vintage-Style-Japenese-Ramen-Cat-by-ethandirks/29259723.FB110.XYZ
stranger thing upside essential shirt,https://www.redbubble.com/i/t-shirt/Stranger-Things-The-Upside-Down-by-Le-Freak/79737617.FB110.XYZ
brainwashed society lightweight sweatshirt,https://www.redbubble.com/i/sweatshirt/BRAINWASHED-SOCIETY-by-DUMMYSUS/31671788.0LCRC.XYZ
support woman wrong classic shirt,https://www.redbubble.com/i/t-shirt/I-Support-Women-s-Wrongs-by-snazzyseagull/137735591.2EZFS.XYZ
need lawyer call saul classic shirt,https://www.redbubble.com/i/t-shirt/Need-A-Lawyer-Then-Call-Saul-by-alhern67/72518924.ADAKE.XYZ
library kitten classic shirt,https://www.redbubble.com/i/t-shirt/Library-Kittens-by-TaylorRoss1/50194249.S7RYU.XYZ
music lover cat classic shirt,https://www.redbubble.com/i/t-shirt/Music-Lover-Cat-by-clingcling/12634856.IJ6L0.XYZ
end near essential shirt,https://www.redbubble.com/i/t-shirt/The-End-Is-Near-by-BennyBruise/37875639.FB110.XYZ
superior one essential shirt,https://www.redbubble.com/i/t-shirt/SUPERIOR-ONES-by-DREWWISE/38286487.FB110.XYZ
popoki classic shirt,https://www.redbubble.com/i/t-shirt/Popoki-by-littleclyde/14420930.WFLAH.XYZ
lactose intolerant refuse tolerate lactose classic shirt,https://www.redbubble.com/i/t-shirt/Lactose-Intolerant-I-Refuse-to-Tolerate-Lactose-by-snazzyseagull/138393961.IJ6L0.XYZ
great kanagawa tea classic shirt,https://www.redbubble.com/i/t-shirt/The-Great-Kanagawa-Tea-by-vincenttrinidad/36186529.WFLAH.XYZ
golden girl girl girl classic shirt,https://www.redbubble.com/i/t-shirt/Golden-Girls-Girls-Girls-by-peakednthe90s/23802740.WFLAH.XYZ
red panda day list nothing cute fluffy animal procrastinate classic shirt,https://www.redbubble.com/i/t-shirt/Red-Panda-Day-to-Do-List-Nothing-Cute-Fluffy-Animal-Procrastinate-by-BlancaVidal/25565795.7KE4Y.XYZ
wittgenstein rabbit duck illusion classic shirt,https://www.redbubble.com/i/t-shirt/Wittgenstein-Rabbit-Duck-Illusion-by-The-Nerd-Shirt/31829058.IJ6L0.XYZ
ash v evil dead red essential shirt,https://www.redbubble.com/i/t-shirt/Ash-vs-The-Evil-Dead-Red-by-Charlie-Cat/22973863.FB110.XYZ
mischief classic shirt,https://www.redbubble.com/i/t-shirt/Mischief-by-TinkM/22378978.WFLAH.XYZ
brotherhood sumi e classic shirt,https://www.redbubble.com/i/t-shirt/Brotherhood-sumi-e-by-zoezowie79/38662319.WFLAH.XYZ
stay target classic shirt,https://www.redbubble.com/i/t-shirt/Stay-On-Target-1977-by-Purakushi/31485679.IJ6L0.XYZ
