description,url
ghost disapproval classic shirt,https://www.redbubble.com/i/t-shirt/Ghost-Of-Disapproval-by-obinsun/17844852.IJ6L0
street cat essential shirt,https://www.redbubble.com/i/t-shirt/Street-Cats-by-wytrab8/37992310.G22WK
stay positive classic shirt,https://www.redbubble.com/i/t-shirt/Stay-Positive-by-stevenrhodes/79299073.7H7A9
sorry late want come classic shirt,https://www.redbubble.com/i/t-shirt/Sorry-I-m-late-I-didn-t-want-to-come-by-chestify/29664349.IJ6L0
visit arrakis vintage distressed surf dune sci fi classic shirt,https://www.redbubble.com/i/t-shirt/Visit-Arrakis-Vintage-Distressed-Surf-Dune-Sci-Fi-by-Nemons/39719380.S7RYU
bodacious period essential shirt,https://www.redbubble.com/i/t-shirt/The-Bodacious-Period-by-wytrab8/26255784.G22WK
many land one sun classic shirt,https://www.redbubble.com/i/t-shirt/Many-Lands-Under-One-Sun-by-thepapercrane/22317419.IJ6L0
great sushi dragon classic shirt,https://www.redbubble.com/i/t-shirt/Great-Sushi-Dragon-by-ilustrata/31848323.QUQES
hang let overthink lightweight sweatshirt,https://www.redbubble.com/i/sweatshirt/Hang-on-Let-me-overthink-this-by-chestify/29205665.0LCRC
great ramen kanagawa classic shirt,https://www.redbubble.com/i/t-shirt/The-Great-Ramen-off-Kanagawa-by-ilustrata/27578492.QUQES
nature guitar classic shirt,https://www.redbubble.com/i/t-shirt/Nature-Guitar-by-maryedenoa/31044255.IJ6L0
worship coffee classic shirt,https://www.redbubble.com/i/t-shirt/Worship-Coffee-by-stevenrhodes/36338841.IJ6L0
visit tatooine lightweight hoodie,https://www.redbubble.com/i/hoodie/Visit-Tatooine-by-mathiole/27076117.2FUSB
laika space traveler classic shirt,https://www.redbubble.com/i/t-shirt/Laika-space-traveler-by-celestecia/27566510.WFLAH
mtn lp tri blend shirt,https://www.redbubble.com/i/t-shirt/MTN-LP-by-ndtank/21013490.9C40P
cure stupid people classic shirt,https://www.redbubble.com/i/t-shirt/A-Cure-For-Stupid-People-by-stevenrhodes/36339198.QUQES
monkey business classic shirt,https://www.redbubble.com/i/t-shirt/Monkey-Business-by-Nicklas81/9170862.WFLAH
fast furious classic shirt,https://www.redbubble.com/i/t-shirt/Not-Fast-Not-Furious-by-DinoMike/39105775.S7RYU
lover classic shirt,https://www.redbubble.com/i/t-shirt/The-Lovers-by-deniart/27240325.IJ6L0
muppet science chemistry classic shirt,https://www.redbubble.com/i/t-shirt/Muppet-Science-Chemistry-by-TenkenNoKaiten/21671761.S7RYU
fox wild classic shirt,https://www.redbubble.com/i/t-shirt/A-Fox-in-the-Wild-by-ndtank/20726125.WFLAH
catana classic shirt,https://www.redbubble.com/i/t-shirt/Catana-by-vincenttrinidad/43638443.IJ6L0
black cat holding essential shirt,https://www.redbubble.com/i/t-shirt/Black-Cat-Holding-On-by-ShortCoffee/21794430.G22WK
attempted murder white design essential shirt,https://www.redbubble.com/i/t-shirt/Attempted-Murder-White-design-by-jezkemp/9115097.FB110
talk stranger tank top,https://www.redbubble.com/i/tank-top/Don-t-Talk-To-Strangers-by-stevenrhodes/36339456.Z81UR
moon swing classic shirt,https://www.redbubble.com/i/t-shirt/Moon-Swing-by-carbine/23503007.IJ6L0
make smile classic shirt,https://www.redbubble.com/i/t-shirt/Make-a-Smile-by-carbine/12104515.IJ6L0
great retro wave classic shirt,https://www.redbubble.com/i/t-shirt/The-Great-Retro-Wave-by-vincenttrinidad/37987911.IJ6L0
goony never say die grey black classic shirt,https://www.redbubble.com/i/t-shirt/The-Goonies-Never-Say-Die-Grey-on-Black-by-UnconArt/23224892.IJ6L0
osiris classic shirt,https://www.redbubble.com/i/t-shirt/Osiris-by-thepapercrane/27806883.IJ6L0
cute galaxy girl forest wood cabin classic shirt,https://www.redbubble.com/i/t-shirt/Cute-Galaxy-Girl-and-Forest-Wood-Cabin-by-SpringNguyen/145327459.QUQES
edda essential shirt,https://www.redbubble.com/i/t-shirt/EDDA-by-RAIDHO/16246104.FB110
solitude classic shirt,https://www.redbubble.com/i/t-shirt/Solitude-by-thepapercrane/23774041.IJ6L0
choose violence funny duck tobe fonseca classic shirt,https://www.redbubble.com/i/t-shirt/I-Choose-Violence-Funny-Duck-by-Tobe-Fonseca-by-tobiasfonseca/126519354.S7RYU
like girl worse possum word art classic shirt,https://www.redbubble.com/i/t-shirt/I-m-not-like-other-girls-I-m-worse-possum-word-art-by-snazzyseagull/144748919.IJ6L0
cathulhu classic shirt,https://www.redbubble.com/i/t-shirt/Cathulhu-by-ilustrata/27538795.IJ6L0
fighting demon winning rat word art meme classic shirt,https://www.redbubble.com/i/t-shirt/I-m-fighting-my-demons-and-they-are-winning-rat-word-art-meme-by-snazzyseagull/144792371.IJ6L0
love timothee chalamet pedro pascal cursed fan collage classic shirt,https://www.redbubble.com/i/t-shirt/I-Love-Timothee-Chalamet-Pedro-Pascal-Cursed-Fan-Collage-by-snazzyseagull/140733284.IJ6L0
dogtor classic shirt,https://www.redbubble.com/i/t-shirt/Dogtor-by-obinsun/21156247.240QL
breakfast time classic shirt,https://www.redbubble.com/i/t-shirt/Breakfast-Time-by-sandiamelonsl/145432259.WFLAH
cat dimension classic shirt,https://www.redbubble.com/i/t-shirt/The-Cat-Dimension-by-stevenrhodes/67680190.S7RYU
music man classic shirt,https://www.redbubble.com/i/t-shirt/Music-Man-by-opifan/10805289.QUQES
space travel classic shirt,https://www.redbubble.com/i/t-shirt/Space-Travel-by-carbine/12539111.IJ6L0
bone botany pullover hoodie,https://www.redbubble.com/i/hoodie/Bones-and-Botany-by-edemoss/14503228.VR8OC
almighty ocean classic shirt,https://www.redbubble.com/i/t-shirt/Almighty-Ocean-by-thepapercrane/15718061.S7RYU
cute little bug pattern classic shirt,https://www.redbubble.com/i/t-shirt/Cute-Little-Bug-Pattern-by-sandiamelonsl/145434464.WFLAH
human various queer flag classic shirt,https://www.redbubble.com/i/t-shirt/Human-Various-Queer-Flags-1-by-fc13empire/14221526.IJ6L0
fuji classic shirt,https://www.redbubble.com/i/t-shirt/Fuji-by-againstbound/12853567.QUQES
space turtle classic shirt,https://www.redbubble.com/i/t-shirt/Space-Turtles-by-Vierkant/12749033.IJ6L0
nekomancer classic shirt,https://www.redbubble.com/i/t-shirt/Nekomancer-by-ilustrata/31573945.IJ6L0
mountain calling lightweight hoodie,https://www.redbubble.com/i/hoodie/The-Mountains-Are-Calling-by-thepapercrane/13502980.Z4UL5
smart fella fart smella classic shirt,https://www.redbubble.com/i/t-shirt/you-re-a-smart-fella-or-a-fart-smella-by-snazzyseagull/139505998.IJ6L0
think twice even think capybara word art classic shirt,https://www.redbubble.com/i/t-shirt/Think-Twice-I-Don-t-Even-Think-Once-capybara-word-art-by-snazzyseagull/144542187.22W0K
takoyaki attack classic shirt,https://www.redbubble.com/i/t-shirt/Takoyaki-Attack-by-ilustrata/32217975.QUQES
love oscar isaac pedro pascal cursed fan collage classic shirt,https://www.redbubble.com/i/t-shirt/I-Love-Oscar-Isaac-Pedro-Pascal-Cursed-Fan-Collage-by-snazzyseagull/141188158.IJ6L0
crisis possum word art classic shirt,https://www.redbubble.com/i/t-shirt/I-am-having-a-crisis-possum-word-art-by-snazzyseagull/144355456.IJ6L0
jurassic jesus pullover sweatshirt,https://www.redbubble.com/i/sweatshirt/JURASSIC-JESUS-by-ilustrata/24812167.73735
octopsychedelia classic shirt,https://www.redbubble.com/i/t-shirt/Octopsychedelia-by-taojb/14477977.WFLAH
rainbow fox classic shirt,https://www.redbubble.com/i/t-shirt/Rainbow-Fox-by-AndyWestface/12471414.QUQES
vintage kraken attacking ship illustration classic shirt,https://www.redbubble.com/i/t-shirt/Vintage-Kraken-attacking-ship-illustration-by-monsterplanet/30197968.WFLAH
armed knowledge classic shirt,https://www.redbubble.com/i/t-shirt/Armed-With-Knowledge-by-martinascott/38710266.IJ6L0
broccozilla classic shirt,https://www.redbubble.com/i/t-shirt/THE-BROCCOZILLA-by-ilustrata/25623124.WFLAH
honey moon tank top,https://www.redbubble.com/i/tank-top/Honey-moon-by-Laorel/33663281.B4HC7
buffalo bill body lotion death head moth horror distressed vintage design classic shirt,https://www.redbubble.com/i/t-shirt/Buffalo-Bill-s-Body-Lotion-Death-s-Head-Moth-Horror-Distressed-Vintage-Design-by-Nemons/52441986.IJ6L0
zombie classic shirt,https://www.redbubble.com/i/t-shirt/zombie-by-DrTigrou/21285521.0S66D
never better classic shirt,https://www.redbubble.com/i/t-shirt/Never-Better-by-deniart/69873829.IJ6L0
nature guitar classic shirt,https://www.redbubble.com/i/t-shirt/Nature-Guitar-by-maryedenoa/24959974.WFLAH
thought head empty frog retro word art meme classic shirt,https://www.redbubble.com/i/t-shirt/no-thoughts-head-empty-frog-retro-word-art-meme-by-snazzyseagull/144083420.IJ6L0
black great ramen classic shirt,https://www.redbubble.com/i/t-shirt/The-black-Great-Ramen-by-ilustrata/42418713.IJ6L0
zoom zoom moon premium shirt,https://www.redbubble.com/i/t-shirt/Zoom-zoom-to-the-moon-by-tutusfajar/145301332.LKP5W
say sport tank top,https://www.redbubble.com/i/tank-top/Say-No-to-Sports-by-stevenrhodes/29239764.91MFL
lady amalthea last unicorn classic shirt,https://www.redbubble.com/i/t-shirt/Lady-Amalthea-The-Last-Unicorn-by-medusadollmaker/38573021.VL7OD
today classic shirt,https://www.redbubble.com/i/t-shirt/Not-Today-by-FoxShiver/85381169.IJ6L0
ti scratch essential shirt,https://www.redbubble.com/i/t-shirt/Tis-But-a-Scratch-by-trev4000/37396874.G22WK
parker knoll parent trap classic shirt,https://www.redbubble.com/i/t-shirt/Parker-knoll-parent-trap-by-NomiBee/105040353.240QL
never forget pluto retro style funny space science classic shirt,https://www.redbubble.com/i/t-shirt/Never-Forget-Pluto-Retro-Style-Funny-Space-Science-by-Benyass/54793971.IJ6L0
introvert unite separately home essential shirt,https://www.redbubble.com/i/t-shirt/Introverts-unite-separately-in-your-own-homes-by-King84/12718799.FB110
nature music sound wave classic shirt,https://www.redbubble.com/i/t-shirt/Nature-s-Music-Sound-Wave-by-maryedenoa/64492496.IJ6L0
snowy classic shirt,https://www.redbubble.com/i/t-shirt/Snowy-by-littleclyde/16884325.IJ6L0
roll initiative tank top,https://www.redbubble.com/i/tank-top/Roll-Initiative-by-optimisteve/25849169.W3P4V
music man essential shirt,https://www.redbubble.com/i/t-shirt/Music-Man-by-Krydel/7237433.NL9AC
mountain star lightweight hoodie,https://www.redbubble.com/i/hoodie/Between-The-Mountains-And-The-Stars-by-thepapercrane/33883790.O6XP1
house cat rainbow dj kitty essential shirt,https://www.redbubble.com/i/t-shirt/HOUSE-CAT-Rainbow-DJ-Kitty-by-robotface/23942630.FB110
lunar fruit essential shirt,https://www.redbubble.com/i/t-shirt/LUNAR-FRUIT-by-jamesormiston/16614830.FB110
bug reading classic shirt,https://www.redbubble.com/i/t-shirt/Don-t-Bug-Me-I-m-Reading-by-sandiamelonsl/145433937.WFLAH
vote pedro pascal classic shirt,https://www.redbubble.com/i/t-shirt/Vote-For-Pedro-Pascal-by-snazzyseagull/140733565.WFLAH
trying best raccoon word art meme classic shirt,https://www.redbubble.com/i/t-shirt/I-am-trying-my-best-raccoon-word-art-meme-by-snazzyseagull/145178884.S7RYU
image metallic colorful sequin look disco ball image glitterpattern graphic shirt,https://www.redbubble.com/i/t-shirt/Image-of-Metallic-Colorful-Sequins-Look-Disco-Ball-Image-GlitterPattern-by-artonwear/9122557.1YYVU
unicorn riding dinosaur shirt rex funny unicorn party rainbow squad gift kid boy girl essential shirt,https://www.redbubble.com/i/t-shirt/Unicorn-Riding-Dinosaur-T-Shirt-T-Rex-Funny-Unicorns-Party-Rainbow-Squad-Gifts-for-Kids-Boys-Girls-by-LiqueGifts/28357302.UIIS2
potential energy essential shirt,https://www.redbubble.com/i/t-shirt/I-Have-Potential-Energy-by-TheShirtYurt/13168175.FB110
yellow cosmos flower pullover hoodie,https://www.redbubble.com/i/hoodie/Yellow-Cosmos-Flowers-by-JRoseDesign/32021498.VR8OC
good day sail classic shirt,https://www.redbubble.com/i/t-shirt/Good-day-to-sail-by-KikkoHiro/43626717.WFLAH
moon play classic shirt,https://www.redbubble.com/i/t-shirt/Moon-Play-by-nicebleed/27404681.IJ6L0
learn recycling classic shirt,https://www.redbubble.com/i/t-shirt/Learn-About-Recycling-by-stevenrhodes/134614658.QUQES
way retro classic shirt,https://www.redbubble.com/i/t-shirt/This-is-the-Way-Retro-by-creativearmory/43630943.QUQES
live laugh lobotomy classic shirt,https://www.redbubble.com/i/t-shirt/live-laugh-lobotomy-by-snazzyseagull/138531517.240QL
play beat classic shirt,https://www.redbubble.com/i/t-shirt/Play-that-beat-by-tonyneal/23718392.WFLAH
want leave classic shirt,https://www.redbubble.com/i/t-shirt/I-Want-To-Leave-by-rfad/22847102.IJ6L0
cure forest essential shirt,https://www.redbubble.com/i/t-shirt/The-Cure-A-Forest-by-LapinMagnetik/56445040.FB110
vintage th birthday gift distressed design essential shirt,https://www.redbubble.com/i/t-shirt/Vintage-1973-50th-Birthday-Gift-Distressed-Design-by-RicardoTito/43183696.FB110
oh fox sake essential shirt,https://www.redbubble.com/i/t-shirt/Oh-For-Fox-Sake-by-revoltz/13160807.UIIS2
marika chibi classic shirt,https://www.redbubble.com/i/t-shirt/marika-chibi-by-Sefionn/144752772.WFLAH
adhd rock music parody classic shirt,https://www.redbubble.com/i/t-shirt/I-Have-ADHD-rock-music-parody-by-snazzyseagull/143449501.IJ6L0
birch classic shirt,https://www.redbubble.com/i/t-shirt/The-Birches-by-littleclyde/15703733.IJ6L0
death cassette tape classic shirt,https://www.redbubble.com/i/t-shirt/The-death-of-the-cassette-tape-by-wanungara/3810729.XNZKR
cheshire cat classic shirt,https://www.redbubble.com/i/t-shirt/CHESHIRE-CAT-by-medusadollmaker/25966661.IJ6L0
los pollos hermanos essential shirt,https://www.redbubble.com/i/t-shirt/Los-pollos-hermanos-by-Jo-oy/57953344.NL9AC
black white collage grunge newspaper fragment premium shirt,https://www.redbubble.com/i/t-shirt/Black-And-White-Collage-Of-Grunge-Newspaper-Fragments-by-artsandsoul/55126146.D681C
cute cat eating ramen essential shirt,https://www.redbubble.com/i/t-shirt/Cute-Cat-Eating-Ramen-by-ethandirks/29259710.FB110
shai hulud sandworm classic shirt,https://www.redbubble.com/i/t-shirt/Shai-Hulud-The-Sandworm-by-7115/96965777.IJ6L0
let run away pullover sweatshirt,https://www.redbubble.com/i/sweatshirt/Let-s-Run-Away-by-stevenrhodes/36339076.73735
telling shrimp fried rice dad joke pun classic shirt,https://www.redbubble.com/i/t-shirt/You-re-Telling-Me-A-Shrimp-Fried-This-Rice-Dad-Joke-Pun-by-snazzyseagull/140231816.IJ6L0
rootin shootin mostly tootin cowboy raccoon word art classic shirt,https://www.redbubble.com/i/t-shirt/rootin-shootin-but-mostly-tootin-cowboy-raccoon-word-art-by-snazzyseagull/144190685.S7RYU
plato play doh philosophy pun classic shirt,https://www.redbubble.com/i/t-shirt/Plato-Play-Doh-Philosophy-pun-by-snazzyseagull/141406753.WFLAH
spooky pal classic shirt,https://www.redbubble.com/i/t-shirt/Spooky-Pals-by-obinsun/32304862.WFLAH
jellyspace lightweight sweatshirt,https://www.redbubble.com/i/sweatshirt/Jellyspace-by-angoes25/21607610.9HM5V
chicken game shirt funny chicken joke essential shirt,https://www.redbubble.com/i/t-shirt/Chicken-Game-T-Shirt-Funny-Chicken-Joke-by-dumbshirts/22086868.UIIS2
get loser seizing mean production essential shirt,https://www.redbubble.com/i/t-shirt/Get-In-Loser-We-re-Seizing-The-Means-Of-Production-by-dumbshirts/32217778.GDEN5
aquatic spectrum premium shirt,https://www.redbubble.com/i/t-shirt/Aquatic-Spectrum-by-Waynem79/39848350.DYMRA
minimal solar system lightweight sweatshirt,https://www.redbubble.com/i/sweatshirt/Minimal-Solar-System-by-geekchic/29093552.0LCRC
flower picking frog classic shirt,https://www.redbubble.com/i/t-shirt/Flower-Picking-Frog-by-sandiamelonsl/145432375.WFLAH
zipped hoodie,https://www.redbubble.com/i/hoodie/Up-by-AndyWestface/17883465.R76QN
zach bryan quiet heavy dream classic shirt,https://www.redbubble.com/i/t-shirt/Zach-Bryan-Quiet-Heavy-Dreams-by-SkyAfterDusk/112372058.QUQES
space dog pullover sweatshirt,https://www.redbubble.com/i/sweatshirt/Space-dogs-by-celestecia/23467022.73735
cool binary tree coding computer science shirt gift woman men classic shirt,https://www.redbubble.com/i/t-shirt/Cool-Binary-Tree-Coding-Computer-Science-T-Shirts-Gifts-for-Women-Men-by-Anna0908/29724117.IJ6L0
team jacob cursed fan collage classic shirt,https://www.redbubble.com/i/t-shirt/Team-Jacob-Cursed-Fan-Collage-by-snazzyseagull/140006672.IJ6L0
let make brownie classic shirt,https://www.redbubble.com/i/t-shirt/Let-s-Make-Brownies-by-stevenrhodes/33991975.22W0K
retro gaming machine classic shirt,https://www.redbubble.com/i/t-shirt/Retro-gaming-machine-by-ilustrata/33887504.S7RYU
vintage muppet show essential shirt,https://www.redbubble.com/i/t-shirt/Vintage-Muppet-Show-by-BrokenHorn/26072874.6ATOD
music classic shirt,https://www.redbubble.com/i/t-shirt/Music-by-ThinkyPain/13499730.IJ6L0
foiled essential shirt,https://www.redbubble.com/i/t-shirt/Foiled-Again-by-rebekieb/10399808.6ATOD
tech support pullover sweatshirt,https://www.redbubble.com/i/sweatshirt/I-m-from-tech-support-by-OffensiveFun/24188248.73735
linear light classic shirt,https://www.redbubble.com/i/t-shirt/Linear-Light-by-thepapercrane/28811065.IJ6L0
tatooine classic shirt,https://www.redbubble.com/i/t-shirt/Tatooine-by-floresarts/20444237.WFLAH
achieve dream classic shirt,https://www.redbubble.com/i/t-shirt/Achieve-Your-Dreams-by-stevenrhodes/30602527.WFLAH
great ramen wave classic shirt,https://www.redbubble.com/i/t-shirt/Great-Ramen-Wave-by-vincenttrinidad/31747027.IJ6L0
donkey girl love horse parody classic shirt,https://www.redbubble.com/i/t-shirt/Donkey-Just-A-Girl-That-Loves-Horses-Parody-by-snazzyseagull/144950223.WFLAH
thomas tank classic shirt,https://www.redbubble.com/i/t-shirt/Thomas-The-Tank-by-FrederickJay/33885425.22W0K
cat murderous black cat knife gift premium shirt classic shirt,https://www.redbubble.com/i/t-shirt/Cat-What-Murderous-Black-Cat-With-Knife-Gift-Premium-T-Shirt-by-ZeLittleFamily/43523705.WFLAH
cyberpunk vaporwave japanese classic shirt,https://www.redbubble.com/i/t-shirt/Cyberpunk-Vaporwave-Japanese-by-OWLvision33/55417587.WFLAH
jasmine dragon tea house classic shirt,https://www.redbubble.com/i/t-shirt/Jasmine-Dragon-Tea-House-by-vintage-pete/53353107.QUQES
shark classic shirt,https://www.redbubble.com/i/t-shirt/Sharks-by-AmyHamilton/13998564.WFLAH
book dinosaur classic shirt,https://www.redbubble.com/i/t-shirt/BOOK-DINOSAURS-01-by-bonniepangart/25577606.S7RYU
boomstick classic shirt,https://www.redbubble.com/i/t-shirt/This-is-my-Boomstick-by-therocketman/28551751.IJ6L0
true vintage racer essential shirt,https://www.redbubble.com/i/t-shirt/True-vintage-racer-2-by-Subspeed/37426528.BTWM1
trash trash wholesome cute raccoon meme classic shirt,https://www.redbubble.com/i/t-shirt/it-s-trash-CAN-not-trash-CAN-T-wholesome-cute-raccoon-meme-by-snazzyseagull/144576121.IJ6L0
like cat coffee maybe people classic shirt,https://www.redbubble.com/i/t-shirt/I-Like-cats-And-Coffee-And-Maybe-3-People-by-adam07/58852391.IJ6L0
eat nut allergic nut allergy classic shirt,https://www.redbubble.com/i/t-shirt/I-can-t-eat-nuts-I-m-allergic-nut-allergy-by-snazzyseagull/143813345.IJ6L0
frog toad classic shirt,https://www.redbubble.com/i/t-shirt/Frog-and-Toad-by-ruthierue/50592676.WFLAH
hoptopus beer drinking octopus classic shirt,https://www.redbubble.com/i/t-shirt/Hoptopus-The-Beer-Drinking-Octopus-by-HabbyArt/48700135.QUQES
dance devil pullover sweatshirt,https://www.redbubble.com/i/sweatshirt/Dance-with-the-Devil-by-TheWhiteBear/23399243.LEP2X
furby existence pain classic shirt,https://www.redbubble.com/i/t-shirt/Furby-Existence-is-Pain-by-snazzyseagull/141481096.IJ6L0
adopt familiar classic shirt,https://www.redbubble.com/i/t-shirt/Adopt-A-Familiar-by-stevenrhodes/79301765.IJ6L0
idea pullover hoodie,https://www.redbubble.com/i/hoodie/I-have-no-idea-what-I-m-doing-by-chestify/34993927.YFBT8
tatooine sun classic shirt,https://www.redbubble.com/i/t-shirt/TATOOINE-SUN-by-yellowmadcat/35312568.WFLAH
goku riding motocycle dragon ball classic shirt,https://www.redbubble.com/i/t-shirt/Goku-Riding-a-motocycle-Dragon-Ball-by-dystopix/76696722.WFLAH
scranton electric city classic shirt,https://www.redbubble.com/i/t-shirt/Scranton-The-Electric-City-by-boboman13/47668180.IJ6L0
gay trying murder classic shirt,https://www.redbubble.com/i/t-shirt/these-gays-they-are-trying-to-murder-me-by-naiverider/135515383.WFLAH
surely everybody kung fu fighting essential shirt,https://www.redbubble.com/i/t-shirt/Surely-Not-Everybody-Was-Kung-Fu-Fighting-by-kjanedesigns/23569322.BTWM1
parker knoll classic shirt,https://www.redbubble.com/i/t-shirt/Parker-Knoll-by-paulusjart/27543158.240QL
thistle moth classic shirt,https://www.redbubble.com/i/t-shirt/Thistle-and-moth-by-Laorel/43088284.IJ6L0
chillin flamingo tiger pullover sweatshirt,https://www.redbubble.com/i/sweatshirt/Chillin-Flamingo-Tiger-by-38Sunsets/26317050.73735
elwood jake classic shirt,https://www.redbubble.com/i/t-shirt/Elwood-and-Jake-by-thedrumstick/34851612.0S66D
yharnam blood vial essential shirt,https://www.redbubble.com/i/t-shirt/Yharnam-s-Blood-Vials-by-wonderjosh3000/27215442.FB110
larus marinus classic shirt,https://www.redbubble.com/i/t-shirt/Larus-Marinus-by-thepapercrane/15569359.S7RYU
eurovision finland k rij cha cha cha classic shirt,https://www.redbubble.com/i/t-shirt/Eurovision-2023-Finland-K%C3%A4%C3%A4rij%C3%A4-Cha-Cha-Cha-by-humnoo/142171790.IJ6L0
barnabus pullover sweatshirt,https://www.redbubble.com/i/sweatshirt/Barnabus-by-opifan/11500293.73735
retro flower vintage style floral pattern thulian pink orange mustard cream classic shirt,https://www.redbubble.com/i/t-shirt/Retro-60s-70s-Flowers-Vintage-Style-Floral-Pattern-in-Thulian-Pink-Orange-Mustard-and-Cream-by-kierkegaard/76496066.IJ6L0
hattori hanzo classic shirt,https://www.redbubble.com/i/t-shirt/Hattori-Hanzo-by-NinoMelon/26907137.IJ6L0
kame house beach club classic shirt,https://www.redbubble.com/i/t-shirt/Kame-House-Beach-Club-by-TravisPixels/52625305.240QL
rick astley president essential shirt,https://www.redbubble.com/i/t-shirt/Rick-Astley-For-President-by-kjanedesigns/23625613.NL9AC
starry night mountain classic shirt,https://www.redbubble.com/i/t-shirt/Starry-Night-in-the-Mountains-by-ndtank/14488649.QUQES
neon genesis evangelion retro vintage essential shirt,https://www.redbubble.com/i/t-shirt/Neon-Genesis-Evangelion-Retro-Vintage-by-Teebuya/62800761.FB110
death ride black cat classic shirt,https://www.redbubble.com/i/t-shirt/Death-Rides-A-Black-Cat-by-obinsun/28571846.IJ6L0
odin essential shirt,https://www.redbubble.com/i/t-shirt/ODIN-by-RAIDHO/14523914.FB110
kata tank top,https://www.redbubble.com/i/tank-top/What-s-your-Kata-by-THEILO/63129955.B4HC7
los jibbities original classic shirt,https://www.redbubble.com/i/t-shirt/Los-Jibbities-Original-by-Dezthelez/79620770.IJ6L0
stag beetle classic shirt,https://www.redbubble.com/i/t-shirt/STAG-BEETLE-by-Covin-Art/144763317.WFLAH
red dwarf london jet classic shirt,https://www.redbubble.com/i/t-shirt/Red-Dwarf-London-Jets-by-UnconArt/28029133.XNZKR
winner pullover sweatshirt,https://www.redbubble.com/i/sweatshirt/The-winner-by-soltib/11777093.73735
cast fireball wizard sorcerer dm gift ttrpg classic shirt,https://www.redbubble.com/i/t-shirt/I-cast-Fireball-Wizard-Sorcerer-DM-Gift-TTRPG-by-hayseedbyte/42221167.IJ6L0
raccoon wielding ukulele classic shirt,https://www.redbubble.com/i/t-shirt/Raccoon-wielding-ukulele-by-autoboxdesign/28659732.WFLAH
pride tree life classic shirt,https://www.redbubble.com/i/t-shirt/Pride-tree-of-life-by-EllyBurg/81245057.9V5H1
beloved one classic shirt,https://www.redbubble.com/i/t-shirt/Beloved-One-by-mazzucchi/145101141.IJ6L0
grumpy frog matsumoto hoji classic shirt,https://www.redbubble.com/i/t-shirt/Grumpy-Frog-Matsumoto-Hoji-by-nphindenberg/57170597.QUQES
paused game essential shirt,https://www.redbubble.com/i/t-shirt/I-Paused-My-Game-To-Be-Here-by-keepers/31411444.BTWM1
raven tank top,https://www.redbubble.com/i/tank-top/Raven-by-Nicklas81/11425673.E1H7L
jesus meme saw classic shirt,https://www.redbubble.com/i/t-shirt/Jesus-Meme-I-Saw-That-by-Beltschazar/45708318.IJ6L0
honk essential shirt,https://www.redbubble.com/i/t-shirt/HONK-by-Eilex-Design/41741437.UIIS2
dungeon dragon classic shirt,https://www.redbubble.com/i/t-shirt/Dungeons-and-Dragons-1974-by-AstroZombie6669/66773725.XNZKR
holy bibble classic shirt,https://www.redbubble.com/i/t-shirt/The-Holy-Bibble-by-snazzyseagull/143965637.S7RYU
dr teeth pullover hoodie,https://www.redbubble.com/i/hoodie/Dr-Teeth-by-victor-calahan/36167887.VY21C
enjoy morning breeze classic shirt,https://www.redbubble.com/i/t-shirt/Enjoy-the-morning-breeze-by-oxfordcoma/144716222.WFLAH
god war ragnar k comic book cover fan art classic shirt,https://www.redbubble.com/i/t-shirt/God-of-War-Ragnar%C3%B6k-Comic-book-cover-Fan-Art-by-MarkScicluna/110042920.S7RYU
librarian horde pullover sweatshirt,https://www.redbubble.com/i/sweatshirt/The-Librarians-Horde-by-rebekieb/23071230.6W81E
ray petz hungry little dog classic shirt,https://www.redbubble.com/i/t-shirt/Ray-Petz-The-Hungry-Little-Dog-by-VersaTee/145226434.WFLAH
let eat trash get hit car essential shirt,https://www.redbubble.com/i/t-shirt/Let-s-Eat-Trash-Get-Hit-By-A-Car-by-Desginfirst/52965834.FB110
litany fear classic shirt,https://www.redbubble.com/i/t-shirt/Litany-Against-Fear-by-robertpartridge/18279086.IJ6L0
defense left unsupervised lightweight hoodie,https://www.redbubble.com/i/hoodie/In-my-defense-I-was-left-unsupervised-by-chestify/35016188.O6XP1
adventurer cat lightweight sweatshirt,https://www.redbubble.com/i/sweatshirt/Adventurer-Cat-by-clingcling/13136761.0LCRC
magic mushroom buddha classic shirt,https://www.redbubble.com/i/t-shirt/Magic-Mushroom-Buddha-by-underheaven/42267800.IJ6L0
anor londo archery club essential shirt,https://www.redbubble.com/i/t-shirt/ANOR-LONDO-ARCHERY-CLUB-by-TwistedBeard/21747189.FB110
drink coffee hate people know thing cat lover gift essential shirt,https://www.redbubble.com/i/t-shirt/That-s-What-I-Do-I-Drink-Coffee-I-Hate-People-And-I-Know-Things-Cat-Lover-Gifts-by-moonchildworld/53997571.FB110
black metal pinhead essential shirt,https://www.redbubble.com/i/t-shirt/Black-Metal-Pinhead-by-samRAW08/21446043.FB110
horror house classic shirt,https://www.redbubble.com/i/t-shirt/Horror-House-by-dooomcat/41574531.QUQES
